"","clbid","credits","crsid","departments","description","groupid","grouptype","halfcredit","instructors","level","locations","name","notes","number","pn","prerequisites","section","semester","status","term","times","title","type","year","enrolled"
"1",10217,1,4,"['AMST']","This analysis of modern American society introduces theories and methods of culture studies, beginning with anthropological definitions of culture and including perspectives of sociology, political science, history, art history and English. Students examine the moral ecology of everyday life in America, looking at the cultural meanings of work, clothes, food, family, gender, buildings, bodies, television, advertising and education.",NA,"",NA,"['James Farrell']",100,"['RML 421']","Perspect Am Culture","",100,"False","False","",1,"C",20051,"['MWF 1045-1140']","American Culture: Interdisciplinary Perspectives","Research",2005,29
"32",10248,1,60,"['ART']","This course explores the arts and architecture of western Europe from c. 300 to c. 1300. Through lectures and discussions we study paintings, sculpture, manuscripts, metalwork and stained glass windows created by the many cultures of this rich and diverse period in the history of art. Students approach the material in a variety of ways: in addition to issues of style, technique and iconography, students address issues of viewing, patronage and gender throughout the semester.",NA,"",NA,"['Nancy M. Thompson']",200,"['DC 305', 'DC 305']","Medieval Art","",263,"False","False","",1,"C",20051,"['T 0935-1100', 'Th 0930-1050']","","Research",2005,28
"50",10266,1,76,"['ASIAN']","This seminar introduces students to East Asian cultures through the familiar institution of family. In contemporary novels, autobiographies and short stories, students read about the struggles between traditional ideals and modern pressures as East Asians strive to define themselves within families. The course also develops students' writing skills to prepare them for the rest of their college coursework.",NA,"",NA,"['Barbara Reed']",100,"['OM 011', 'OM 011']","Family & Self/E Asia","",111,"False","False","",1,"C",20051,"['T 1145-0110PM', 'Th 1245-0205PM']","Asian Conversations: Family and Self in East Asia","Research",2005,21
"51",10267,1,78,"['ASIAN']","This course examines major cultures of South, Southeast and East Asia from interdisciplinary and comparative perspectives with attention to theories of human behavior. Themes vary from year to year but may include Asian cities, heroic ideals, village and family life, population growth, gender roles and medicine and healing traditions. No prerequisites.",NA,"",NA,"['Karil J. Kucera']",100,"['DC 305']","Asian Cultures","",121,"False","False","",1,"O",20051,"['MWF 0200-0255PM']","Asian Cultures in Comparative Perspectives","Research",2005,27
"53",10269,1,84,"['ASIAN']","Using rice (and agriculture more generally) as a means of access, this course will introduce students to an examination of the societies, politics and economies of East Asian countries. Drawing on social science methods, it looks at traditional East Asian societies as well as the drive for modernization and the consequences that modernization has had on these societies. Prerequisite: Asian Studies 112 or permission of the instructor. Counts toward the Asian Studies major.",NA,"",NA,"['Bruce Dalgaard']",200,"['OM 011', 'OM 011']","Rice & Society/E Asia","",211,"False","Prerequisite: Asian Studies 112 or permission of the instructor. Counts toward the Asian Studies major.","",1,"C",20051,"['T 0120-0245PM', 'Th 0215-0335PM']","Asian Conversations: Rice and Society in East Asia","Research",2005,18
"54",10270,1,89,"['ASIAN']","This course looks at language as it creates and responds to its cultural and social environments. Students compare and contrast major aspects of language use in Japan and the United States. Students explore the general underlying elements of talk (e.g., standard vs. regional dialects, language attitude and ideologies, politeness, gendered speech patterns, communication styles) and learn to understand how speakers convey subtle meanings, sometimes unconsciously. Knowledge of Japanese is helpful but not necessary. Taught in English.",NA,"",NA,"['Rika Ito']",200,"['OM 002', 'OM 002']","Talking in Japan/Us","",240,"False","False","",1,"C",20051,"['T 1145-0110PM', 'Th 1245-0205PM']","Talking in Japan and the U.S.: Language, Identity and Beyond","Research",2005,23
"58",10274,1,98,"['ASIAN']","The seminar intensively studies topics in Asian studies. Prerequisite: senior Asian studies major or concentrator, or permission of the instructor.",NA,"",NA,"['Robert Entenmann']",300,"['HH 515', 'HH 515']","Sem: Asia","",399,"False","Prerequisite: senior Asian studies major or concentrator, or permission of the instructor.","",1,"C",20051,"['T 0935-1100', 'Th 0930-1050']","Seminar","Seminar",2005,20
"78",10311,1,158,"['BIO']","The cell is the fundamental unit of life, capable of growth, motility, signal transduction and functional specialization. Students study features common to cells: metabolism, membrane transport, motility, signal mechanisms and intracellular trafficking, seeing how these are elaborated in cells with particular specializations. Research techniques suitable for cell physiology are emphasized. Students attend lectures plus one 3-hour laboratory per week. Taught annually. Prerequisites: Biology 125, 126, Chemistry 125, 126.",158,"A",NA,"['Anne Walter']",300,"['SC 274']","Cell Physiology","Students in Biology 341 must also register for one lab section 341AL or BL.",341,"False","Prerequisites: Biology 125, 126, Chemistry 125, 126.","",1,"O",20051,"['MWF 0905-1000']","","Research",2005,22
"91",10326,1,176,"['AMCON']","Spanning two centuries, from the founding of the colonies to the close of the Civil War, this course begins our discussion of questions central to the entire sequence: What is an American? What does it mean to be free? Students explore the institutions, images and stories of Euro-Americans, African Americans and Native Americans.Topics and texts include the Declaration of Independence and Thomas Jefferson's architecture, the Narrative of the Life of Frederick Douglass and the coming of the Civil War.",NA,"",NA,"['L. DeAne Lagerquist']",100,"['BMC 101']","Freedoms: 1607-1865","",101,"False","False","A",1,"C",20051,"['MWF 0905-1000']","Declaring Independence, 1620-1865","Research",2005,18
"92",10327,1,176,"['AMCON']","Spanning two centuries, from the founding of the colonies to the close of the Civil War, this course begins our discussion of questions central to the entire sequence: What is an American? What does it mean to be free? Students explore the institutions, images and stories of Euro-Americans, African Americans and Native Americans.Topics and texts include the Declaration of Independence and Thomas Jefferson's architecture, the Narrative of the Life of Frederick Douglass and the coming of the Civil War.",NA,"",NA,"['Colin Wells']",100,"['BMC 109']","Freedoms: 1607-1865","",101,"False","False","B",1,"C",20051,"['MWF 0905-1000']","Declaring Independence, 1620-1865","Research",2005,21
"93",10328,1,178,"['AMCON']","Burgeoning cities and industrialism, an emerging market economy, changing opportunities for women, an influx of immigrants and the migration of African Americans to urban centers -- all opened questions of freedom of expression, distribution of resources and American identity. Topics and texts include the Statue of Liberty, the World's Columbian Exposition, the Model T Ford and the Harlem Renaissance.",NA,"",NA,"['Mary Titus']",200,"['RML 525']","Remaking Am: 1845-1945","",201,"False","False","A",1,"C",20051,"['MWF 1255-0150PM']","Re-making America, 1865-1945","Research",2005,21
"94",10329,1,178,"['AMCON']","Burgeoning cities and industrialism, an emerging market economy, changing opportunities for women, an influx of immigrants and the migration of African Americans to urban centers -- all opened questions of freedom of expression, distribution of resources and American identity. Topics and texts include the Statue of Liberty, the World's Columbian Exposition, the Model T Ford and the Harlem Renaissance.",NA,"",NA,"['Judy Kutulas']",200,"['RML 577']","Remaking Am: 1845-1945","",201,"False","False","B",1,"C",20051,"['MWF 1255-0150PM']","Re-making America, 1865-1945","Research",2005,19
"253",10493,1,429,"['ENGL']","Explores various forms of prose, including fiction and creative nonfiction. Each instructor selects different material to be studied and emphasizes various aspects of the form. Topics can range from the 18th-century novel to African American autobiography. May be repeated if topics are different.",NA,"",NA,"['Jon Eric Nelson']",200,"['RML 515']","Top: Prose: Post-Modern","",283,"False","False","A",1,"C",20051,"['MWF 1150-1245PM']","Studies in Prose","Topic",2005,30
"254",10494,1,429,"['ENGL']","Explores various forms of prose, including fiction and creative nonfiction. Each instructor selects different material to be studied and emphasizes various aspects of the form. Topics can range from the 18th-century novel to African American autobiography. May be repeated if topics are different.",NA,"",NA,"['Carlos V. Reyes']",200,"['RML 515']","Top: Prose: Graphic Novel","",283,"False","False","B",1,"C",20051,"['MWF 0200-0255PM']","Studies in Prose","Topic",2005,31
"267",10507,1,451,"['ENGL']","",NA,"",NA,"['Maggie Broner']",300,"","IR/Gender & Lang Choices","",398,"False","False","A",1,"O",20051,"","Independent Research","Research",2005,0
"345",10586,1,534,"['GCON']","Students examine the Renaissance's return to classical values and the Reformation's return to early Christian attitudes which challenge the authority of the medieval synthesis. Students trace the development of new sources of authority including the new science with its influence on art, literature, politics and philosophy. Discussions consider Luther, Calvin, Descartes, Locke, Milton, Aphra Behn, Voltaire, Rousseau, Goethe, Teresa of Avila, Wollstonecraft and the artistry of Michaelangelo, Caravaggio, Bach and Shakespeare.",NA,"",NA,"['Jolene Barjasteh']",200,"['STEENSLAND']","New Forces of Secular","",217,"False","False","A",1,"C",20051,"['MWF 1045-1140']","The Tradition Renewed: New Forces of Secularization","Research",2005,20
"346",10587,1,534,"['GCON']","Students examine the Renaissance's return to classical values and the Reformation's return to early Christian attitudes which challenge the authority of the medieval synthesis. Students trace the development of new sources of authority including the new science with its influence on art, literature, politics and philosophy. Discussions consider Luther, Calvin, Descartes, Locke, Milton, Aphra Behn, Voltaire, Rousseau, Goethe, Teresa of Avila, Wollstonecraft and the artistry of Michaelangelo, Caravaggio, Bach and Shakespeare.",NA,"",NA,"['Diana Postlethwaite']",200,"['STEENSLAND']","New Forces of Secular","",217,"False","False","B",1,"C",20051,"['MWF 1045-1140']","The Tradition Renewed: New Forces of Secularization","Research",2005,19
"347",10588,1,534,"['GCON']","Students examine the Renaissance's return to classical values and the Reformation's return to early Christian attitudes which challenge the authority of the medieval synthesis. Students trace the development of new sources of authority including the new science with its influence on art, literature, politics and philosophy. Discussions consider Luther, Calvin, Descartes, Locke, Milton, Aphra Behn, Voltaire, Rousseau, Goethe, Teresa of Avila, Wollstonecraft and the artistry of Michaelangelo, Caravaggio, Bach and Shakespeare.",NA,"",NA,"['Edmund Santurri']",200,"['STEENSLAND']","New Forces of Secular","",217,"False","False","C",1,"C",20051,"['MWF 1045-1140']","The Tradition Renewed: New Forces of Secularization","Research",2005,20
"348",10589,1,534,"['GCON']","Students examine the Renaissance's return to classical values and the Reformation's return to early Christian attitudes which challenge the authority of the medieval synthesis. Students trace the development of new sources of authority including the new science with its influence on art, literature, politics and philosophy. Discussions consider Luther, Calvin, Descartes, Locke, Milton, Aphra Behn, Voltaire, Rousseau, Goethe, Teresa of Avila, Wollstonecraft and the artistry of Michaelangelo, Caravaggio, Bach and Shakespeare.",NA,"",NA,"['J. L. Carrington']",200,"['HH 514']","New Forces of Secular","",217,"False","False","D",1,"C",20051,"['MWF 1045-1140']","The Tradition Renewed: New Forces of Secularization","Research",2005,23
"357",10598,1,558,"['HIST']","This course examines the history of the Maya peoples from the colonial to the present. Drawing upon missionary accounts, archeological sources and historical and anthropological works, we will explore how the Maya -- despite the multiple traumas of conquest, demographic collapse and state repression -- have managed to survive as a people. Specific topics include: Maya religious beliefs, the impact of Spanish conquest, changing sources of ethnic identity and the emerging Pan-Maya movement of recent years. Offered periodically.",NA,"",NA,"['Jeane DeLaney']",100,"['HH 301', 'HH 301']","Maya Colonial-Present","Open to First-Year Students only.",125,"False","False","",1,"O",20051,"['T 1145-0110PM', 'Th 1245-0205PM']","The Maya, Colonial Times to the Present","Research",2005,17
"359",10602,1,573,"['HIST']","This course surveys Western history and culture from its origins in the Ancient Near East to the Italian Renaissance. Topics include the ancient world, the beginnings of Christianity, the emergence and disintegration of Rome as a unifying power, the Middle Ages and the Renaissance. Through original texts and historical studies, students will explore relationships among religions, states, and societies and views of natural environments, family life, and gender roles. Offered most years.",NA,"",NA,"['J. L. Carrington']",100,"['HH 307']","Eur/Anc/Renaissance","",190,"False","False","",1,"O",20051,"['MWF 1255-0150PM']","Europe from the Ancients to the Renaissance","Research",2005,28
"370",10613,1,612,"['HIST']","In this broad survey of the history of Southern Africa (with a major emphasis on the Republic of South Africa), students engage in readings and classroom activities focusing on the following themes: race and ethnicity, gender, environmental studies, migrant labor, and apartheid and resistance. These focal points illuminate the broader context of change in the South African past. Offered most years.",NA,"",NA,"['Helena Pohlandt-McCormick']",200,"['RML 577']","South Africa","",260,"False","False","",1,"C",20051,"['MWF 1150-1245PM']","","Research",2005,31
"383",10626,1,642,"['HIST']","",NA,"",NA,"['Clifford C. Weston']",300,"","IR/Race/Civil War Era","",398,"False","False","C",1,"O",20051,"","Independent Research","Research",2005,1
"426",10672,1,719,"['LATIN']","Lyric poems -- short, occasional pieces composed in various meters, often concerned with love and longing -- are the focus of this Latin course. Students read the vivacious verse of Catullus, Horace, Tibullus and Ovid and learn to recognize the features that make lyric a distinctive genre of Latin poetry. Prerequisite: Latin 231 or equivalent. GE: FOL-L. Offered every third year.",NA,"",NA,"['Steve T. Reece']",300,"['OM 003', 'OM 003']","Latin Lyric","See also Classics 241.",371,"False","Prerequisite: Latin 231 or equivalent. GE: FOL-L. Offered every third year.","",1,"O",20051,"['T 0120-0245PM', 'Th 0215-0335PM']","Latin Lyric Poetry","Research",2005,11
"482",10731,1,794,"['MEDIA']","This course focuses on contemporary media, primarily film and television, from theoretical and critical perspectives. Primary emphasis is given to the specific identifying characteristics of news, advertising and entertainment media and to how those media serve as forums for cultural negotiation in our society. In particular, attention is paid to how media representations of race, class and gender presently exist as both products and producers of contemporary cultures. Prerequisite: Media Studies 160.",NA,"",NA,"['William Sonnega']",200,"['TB 216', 'TB 216']","Media/Contemp Culture","",260,"False","Prerequisite: Media Studies 160.","",1,"O",20051,"['T 0935-1100', 'Th 0930-1050']","Media and Contemporary Culture","Research",2005,14
"574",10825,1,978,"['PHIL']","This course surveys the influential philosophical traditions of India and China. Students explore the traditions of Hinduism, Buddhism, Jainism, Confucianism and Taoism and consider other traditions with which they have interacted. Where appropriate, comparisons are drawn to Western philosophical traditions.",NA,"",NA,"['Anantanand Rambachan']",200,"['BMC 102', 'BMC 102']","Asian Philosophy","",251,"False","False","",1,"C",20051,"['T 1145-0110PM', 'Th 1245-0205PM']","","Research",2005,25
"663",10914,1,1103,"['PSCI']","The promise of American politics is the equal freedom of all. How does practice match principles? What roles do class and race play? Do interest groups and political parties foster democracy? This course is designed not only to help students understand American government and politics but also to motivate them to be active and informed participants.",NA,"",NA,"['Daniel Hofrenning']",100,"['HH 403', 'HH 403']","American Politics","",111,"False","False","A",1,"O",20051,"['T 0935-1100', 'Th 0930-1050']","","Research",2005,28
"664",10915,1,1103,"['PSCI']","The promise of American politics is the equal freedom of all. How does practice match principles? What roles do class and race play? Do interest groups and political parties foster democracy? This course is designed not only to help students understand American government and politics but also to motivate them to be active and informed participants.",NA,"",NA,"['Donald I. Ostrom']",100,"['HH 403', 'HH 403']","American Politics","",111,"False","False","B",1,"O",20051,"['T 1145-0110PM', 'Th 1245-0205PM']","","Research",2005,32
"665",10916,1,1103,"['PSCI']","The promise of American politics is the equal freedom of all. How does practice match principles? What roles do class and race play? Do interest groups and political parties foster democracy? This course is designed not only to help students understand American government and politics but also to motivate them to be active and informed participants.",NA,"",NA,"['Donald I. Ostrom']",100,"['HH 403', 'HH 403']","American Politics","",111,"False","False","C",1,"O",20051,"['T 0120-0245PM', 'Th 0215-0335PM']","","Research",2005,27
"672",10923,1,1126,"['PSCI']","Sandwiched between Germany and Russia, Central Europe exhibited distinctive political characteristics in its pre-communist, communist and now post-communist periods. The region could not sustain democracy in the 1930s. Does it have a better chance of doing so in the 21st century? In pursuit of an answer, students examine the varying cultural, ethnic and economic contexts of the region's contemporary political problems. Offered periodically.",NA,"",NA,"['D Christopher Brooks']",200,"['HH 516']","Central European Pol","",256,"False","False","",1,"O",20051,"['MWF 0800-0855']","Central European Politics","Research",2005,6
"675",10926,1,1133,"['PSCI']","Students examine ethical issues related to family life in the United States. Topics include the nature and purpose of the family; a history of family structures and values; the family as a school of justice; and the relationship between the family and the state. Students explore a variety of theological and philosophical traditions, on such issues as marriage and divorce, contraception and abortion, parenting practices, and public policy.",NA,"",NA,"['Jo M. Beld']",200,"['HH 317', 'HH 317']","Family Values","",270,"False","False","",1,"C",20051,"['T 0120-0245PM', 'Th 0215-0335PM']","","Research",2005,33
"683",10934,1,1152,"['PSCI']","Students who have taken five political science courses, one of which is in the area of the proposed research, may propose an independent research project to a member of the departmental faculty.",NA,"",NA,"['Kristina Thalhammer']",300,"","IR/African Development","",398,"False","False","",1,"O",20051,"","Independent Research","Research",2005,1
"764",11017,1,1238,"['REL']","This course examines theological and ethical aspects of Christian social responsibility. It examines the meaning and normative import of Christian faith for justice and love in relational spheres (politics, economics, marriage and family, gender relations). It also explores the ethical implications of central Christian doctrines (vocation, sin, grace, two kingdoms, creation). Issues raised include civil disobedience, use of lethal force, distributive justice, love and self-sacrifice, and gender roles. Prerequisite: a BTS-T course.",NA,"",NA,"['Douglas Schuurman']",200,"['BMC 101', 'BMC 101']","Love,Justice,Soc Rel","",296,"False","Prerequisite: a BTS-T course.","A",1,"C",20051,"['T 0935-1100', 'Th 0930-1050']","Love, Justice and Social Relations","Research",2005,24
"765",11018,1,1238,"['REL']","This course examines theological and ethical aspects of Christian social responsibility. It examines the meaning and normative import of Christian faith for justice and love in relational spheres (politics, economics, marriage and family, gender relations). It also explores the ethical implications of central Christian doctrines (vocation, sin, grace, two kingdoms, creation). Issues raised include civil disobedience, use of lethal force, distributive justice, love and self-sacrifice, and gender roles. Prerequisite: a BTS-T course.",NA,"",NA,"['Douglas Schuurman']",200,"['BMC 101', 'BMC 101']","Love,Justice,Soc Rel","",296,"False","Prerequisite: a BTS-T course.","B",1,"C",20051,"['T 1145-0110PM', 'Th 1245-0205PM']","Love, Justice and Social Relations","Research",2005,23
"791",11048,1,1289,"['SOAN']","This course helps students explore the connections between society and their own lives. Students answer challenging questions such as Do we have a &human; nature'?, Why does social inequality exist?, What is race?, and How do societies change? In answering these questions students will learn to develop a sociological imagination. In doing so they will review the various research methods and theories that form the sociological tradition. Offered Fall and Spring Semesters.",NA,"",NA,"['Samiha Peterson']",100,"['SC 130', 'SC 130']","Intro to Sociology","",121,"False","False","A",1,"O",20051,"['T 0800-0925', 'Th 0800-0920']","Introduction to Sociology","Research",2005,23
"792",11049,1,1289,"['SOAN']","This course helps students explore the connections between society and their own lives. Students answer challenging questions such as Do we have a &human; nature'?, Why does social inequality exist?, What is race?, and How do societies change? In answering these questions students will learn to develop a sociological imagination. In doing so they will review the various research methods and theories that form the sociological tradition. Offered Fall and Spring Semesters.",NA,"",NA,"['Samiha Peterson']",100,"['SC 130', 'SC 130']","Intro to Sociology","",121,"False","False","B",1,"O",20051,"['T 0935-1100', 'Th 0930-1050']","Introduction to Sociology","Research",2005,28
"793",11050,1,1289,"['SOAN']","This course helps students explore the connections between society and their own lives. Students answer challenging questions such as Do we have a &human; nature'?, Why does social inequality exist?, What is race?, and How do societies change? In answering these questions students will learn to develop a sociological imagination. In doing so they will review the various research methods and theories that form the sociological tradition. Offered Fall and Spring Semesters.",NA,"",NA,"['Raymond DeVries']",100,"['HH 307', 'HH 307']","Intro to Sociology","",121,"False","False","C",1,"O",20051,"['T 0800-0925', 'Th 0800-0920']","Introduction to Sociology","Research",2005,28
"796",11053,1,1300,"['SOAN']","What do self-determination and cultural identity mean for Native American peoples today? Students examine the impact of colonization on Native American peoples, including federal policies, treaty rights and sovereignty. Issues include economy and politics on reservations, family and gender roles, orality and literacy, persistence and revitalization of religious life and culture, urban life and recent social movements and organizations. Offered Fall or Spring Semester.",NA,"",NA,"['Carolyn Anderson']",200,"['HH 301']","Contemp Native Am","",235,"False","False","A",1,"C",20051,"['MWF 1150-1245PM']","Contemporary Native American Issues","Research",2005,26
"797",11054,1,1300,"['SOAN']","What do self-determination and cultural identity mean for Native American peoples today? Students examine the impact of colonization on Native American peoples, including federal policies, treaty rights and sovereignty. Issues include economy and politics on reservations, family and gender roles, orality and literacy, persistence and revitalization of religious life and culture, urban life and recent social movements and organizations. Offered Fall or Spring Semester.",NA,"",NA,"['Carolyn Anderson']",200,"['HH 301']","Contemp Native Am","",235,"False","False","B",1,"C",20051,"['MWF 0200-0255PM']","Contemporary Native American Issues","Research",2005,19
