"","clbid","credits","crsid","departments","description","gereqs","groupid","grouptype","halfcredit","instructors","level","locations","name","notes","number","pn","prerequisites","section","semester","status","term","times","title","type","year","enrolled"
"809",58975,1,1310,"['SOAN']","This course provides a social science understanding of the ""contemporary American family"" and analysis of marriage and family issues from a cross-cultural perspective. Students discuss issues of dating and mate selection, marital and parent-child relationships over the family life cycle, gender issues, work and family roles, and problem-related issues affecting families (divorce, violence and death) caused by rapid changes in society. Offered Fall or Spring Semester.","",NA,"",NA,"['Ryan R. Sheppard']",200,"['HH 307', 'HH 307']","Marriage & the Family","",260,"False","False","B",3,"C",20073,"['T 0935-1100', 'Th 0930-1050']","Marriage and the Family","Research",2007,17
"816",58982,1,1336,"['SPAN']","Students examine the diverse elements that have shaped Latin American culture through an exploration of political, social, economic, religious, and artistic topics. They develop critical analysis skills through reading, discussion, and written and/or oral projects. The course features the study of selected literary and non-literary texts, including at least one substantive literary work. Taught in Spanish. Prerequisite: Spanish 250.","",NA,"",NA,"['Sylvia Carullo']",200,"['OM 020']","Heritage Latin America","",272,"False","Prerequisite: Spanish 250.","",3,"O",20073,"['MWF 1045-1140']","Cultural Heritage of Latin America","Research",2007,21
"842",59298,1,574,"['HIST']","This course surveys European history and culture since the Reformation. Topics include the impact of Protestantism, the development of nation states, the Enlightenment, revolutionary ideas and experiences, the Napoleonic era, imperialism, mass political movements, and global warfare. Through original texts, historical studies, and literature, students explore relations among religions, states and societies and understandings of liberty and reason, natural environments, family life, and gender roles. Offered most years.","",NA,"",NA,"['Gary De Krey']",100,"['RML 577']","Eur/Reform/Modern","",191,"False","False","",3,"C",20073,"['MWF 0905-1000']","Europe from the Reformation to Modern Times","Research",2007,24
"848",59675,1,18523,"['PSCI']","Currents of nationalism, regionalism and globalization organize political life around the world. What trends and policies promote regional integration? What forces frustrate integration? To answer these questions this course investigates security, economic, and cultural relations at the beginning of the 21st century within Asia and between Asia and Russia and the U.S. This course looks at the historical interaction of national, regional and global forces for additional answers. Prerequisites: Previous course in Asian Studies or Political Science, or permission of instructor.","",NA,"",NA,"['Katherine S. Tegtmeyer Pak']",200,"['HH 413', 'HH 413']","Nation/Region/Globe/Asia","",245,"False","Prerequisites: Previous course in Asian Studies or Political Science, or permission of instructor.","",3,"O",20073,"['T 0120-0245PM', 'Th 0215-0335PM']","Nationalism, Regionalism, Globalization in Asia","Research",2007,13
"855",60486,1,976,"['PHIL']","Students examine feminist critiques of aspects of contemporary culture that shape women's lives, such as conventional morality, science, education, art, medicine, law, religion, and marriage. Students critically examine philosophical views that underlie these institutions, including views of human nature, gender, rationality, knowledge, morality, justice, and the value of autonomy. Alternative feminist views that promote feminist aims are explored and evaluated.","",NA,"",NA,"['Jennifer C. Manion']",200,"['OM 004', 'OM 004']","Philosophy & Feminism","",245,"False","False","",3,"O",20073,"['T 0935-1100', 'Th 0930-1050']","Philosophy and Feminism","Research",2007,23
"869",60824,1,1326,"['SPAN']","Through exploring the geographic and human diversity of the Spanish-speaking world, students develop increasingly complex skills for analyzing and communicating in Spanish. They study such essential dimensions of that world as: (1) geography and development; (2) environmental challenges and solutions; (3) population and demographic changes and challenges; and (4) ethnic diversity. Prerequisite: Spanish 112 or placement. Offered Fall, Interim, and Spring Semesters.","",NA,"",NA,"['Barbara Olson']",200,"['OM 020']","Intermed Spanish I","",231,"False","Prerequisite: Spanish 112 or placement. Offered Fall, Interim, and Spring Semesters.","A",3,"C",20073,"['MWF 0905-1000']","Intermediate Spanish I","Research",2007,14
"875",60834,1,17,"['AFAM']","Based upon courses from participating departments, the seminar introduces students to the historical and cross-cultural experiences of Africans and African Americans. It affords students the chance to engage in interdisciplinary interpretation and analysis and encourages them to interpret their own heritage in light of the African/African American experience. This course emphasizes historical texts.","",NA,"",NA,"['Michael Fitzgerald']",200,"['RML 577']","Sem: Africa/Americas","",232,"False","False","",3,"O",20073,"['MWF 1255-0150PM']","Africa and the Americas: The Diaspora Experience","Seminar",2007,14
"878",60878,1,19726,"['ASIAN']","This course offers in-depth study of a topic. The specific topic depends on the instructor. The course may be repeated if topics are different. Offered periodically.","",NA,"",NA,"['Rika Ito']",300,"['OM 002', 'OM 002']","Topics in Asian Studies","",300,"False","False","",3,"O",20073,"['T 1145-0110PM', 'Th 1245-0205PM']","","Research",2007,9
"879",60879,1,19727,"['ASIAN']","This core course of Asian Studies introduces students to modern Chinese literature and society, a non-Western tradition. It examines canonical and popular works of Chinese writings including fiction, dram, autobiography, correspondences, and poetry written in classical and modern styles from the late nineteenth century to the early twenty-first century. Films also serve as supplementary material when appropriate. Students read texts in translation and approach them in the context of modern Chinese society. They also study the literature according to China's interaction with the West and the country's struggle to define itself as a modern nation. This course is offered annually.","",NA,"",NA,"['Luying Chen']",200,"['RML 525', 'RML 525']","Modern Chinese Lit & Soc","",237,"False","False","",3,"O",20073,"['T 0120-0245PM', 'Th 0215-0335PM']","Modern Chinese Literature and Society","Research",2007,10
"880",60883,1,19733,"['MEDIA']","This course provides a capstone to the concentration. Taught as a seminar, it investigates critical and specialized issues in media from multiple and often competing perspectives. Topics change regularly and address a wide range of media-related concerns. Sample topics include media culture, race and media, media use and child development, and the social and political utility of video documentaries. Prerequisite: Media Studies 160 or permission of instructor. Offered Spring Semester.","",NA,"",NA,"['William Sonnega']",300,"['TB 216', 'TB 216']","Topics in Media","",360,"False","Prerequisite: Media Studies 160 or permission of instructor. Offered Spring Semester.","",3,"C",20073,"['T 1145-0110PM', 'Th 1245-0205PM']","","Research",2007,18
"881",60884,1,19734,"['NORW']","Recently there has been an explosion in Nordic literature translated into English, providing unprecedented access to contemporary literary texts produced in Norway, Sweden, Denmark, Finland, and Iceland. In this course students read and analyze contemporary Nordic literary texts and examine those societies through a literary perspective. Sample topics: ""Murder Nordic Style: Contemporary Crime Fiction"" and ""Gender and Nordic Society."" Prerequisite: First-Year Writing. Offered annually or periodically.","",NA,"",NA,"[""Margaret H. O'Leary""]",200,"['OM 030', 'OM 030']","Top: Contemp. Nordic Lit","",224,"False","Prerequisite: First-Year Writing. Offered annually or periodically.","",3,"O",20073,"['T 0935-1100', 'Th 0930-1050']","Topics in Contemporary Nordic Literature: A Window on Society","Topic",2007,6
"886",60907,1,626,"['HIST']","This course offers selected surveys in historical studies. Topics depend on instructor. Recent topics have included ""Native American History"" and ""Reel America."" Offered periodically. May be repeated if topics are different.","",NA,"",NA,"['Megan J. Feeney']",200,"['OM 001']","Top:US-Latin American Rel","",299,"False","False","",3,"O",20073,"['MWF 0200-0255PM']","Topics in History","Topic",2007,8
"963",64021,1,1190,"['PSYCH']","Students have the opportunity to work in-depth on a research project of interest under the supervision of a member of the psychology department faculty. Prerequisite: Statistics 110, 212 or 263, Psychology 231, four additional courses in the department, and permission of instructor. Psychology 298 is strongly recommended. Offered each semester.","",NA,"",NA,"['Clark Ohnesorge']",300,"","IR/Perception of Gender","",398,"False","Prerequisite: Statistics 110, 212 or 263, Psychology 231, four additional courses in the department, and permission of instructor. Psychology 298 is strongly recommended. Offered each semester.","C",3,"O",20073,"","Independent Research","Research",2007,1
"982",64120,1,1239,"['REL']","","",NA,"",NA,"['Barbara Reed']",200,"","IS/Asian Therapeutic Trad","",298,"False","False","E",3,"O",20073,"","Independent Study","Research",2007,1
