"","clbid","credits","crsid","departments","description","gereqs","groupid","grouptype","halfcredit","instructors","level","locations","name","notes","number","pn","prerequisites","section","semester","status","term","times","title","type","year","enrolled"
"112",57626,1,618,"['HIST']","In this study of African Americans in U. S. society from African origins to the present, students explore the African heritage, the experience of slavery, segregation, and the rise of the Civil Rights movement of the 1960s. The course pays particular attention to the issue of black nationalism as a force in American life. Offered most years.","",NA,"",NA,"['Michael Fitzgerald']",200,"['RML 577', 'RML 577']","African-American Hist","",277,"False","False","",3,"O",20073,"['T 0935-1100', 'Th 0930-1050']","African-American History","Research",2007,31
"127",57644,1,78,"['ASIAN']","This course examines major cultures of Asia from interdisciplinary and comparative perspectives with attention to theories of human behavior. Themes vary from year to year but may include Asian cities, heroic ideals, village and family life, population growth, gender roles, and medicine and healing traditions. No prerequisites.","",NA,"",NA,"['Karil J. Kucera']",100,"['DC 305']","Asian Cultures","",121,"False","False","",3,"C",20073,"['MWF 1150-1245PM']","Asian Cultures in Comparative Perspectives","Research",2007,33
"196",57740,1,158,"['BIO']","The cell is the fundamental unit of life, capable of growth, motility, signal transduction, and functional specialization. Students study features common to cells: their macromolecular components, metabolism, membrane transport, motility, signal mechanisms, and intracellular trafficking, seeing how these are elaborated in cells with particular specializations. Research techniques suitable for cell physiology are emphasized. Students attend lectures plus one 3-hour laboratory per week. Prerequisites: Biology 125 and 126, Chemistry 125 and 126, or Chemistry/Biology 125-127 and Biology 126.","",158,"",NA,"['Mara E. Robu', 'Anne Walter']",300,"['SC 274']","Cell Physiology","Students in Bio 341 must also register for lab Bio 341 L. Open to Juniors and Seniors only.",341,"False","Prerequisites: Biology 125 and 126, Chemistry 125 and 126, or Chemistry/Biology 125-127 and Biology 126.","",3,"O",20073,"['MWF 0905-1000']","","Research",2007,11
"236",57796,1,371,"['DANCE']","Students trace and integrate the African-American and Euro-American dance traditions of the late 19th and 20th centuries and early 21st century, paying attention to their similarities and differences. The focus is on the theatrical dance genres of ballet, modern, and musical theater dance. Students also examine social dance as the predecessor of some theatrical dance genres. At the same time, the course attends to the economic, religious and social forces which have affected the development of dance in America. Extensive video examples supplement reading, writing and discussion. Attendance at appropriate concerts is required. Offered Spring Semester.","",NA,"",NA,"['Mary Kay Conway']",200,"['DC 305']","Dance in America","",246,"False","False","",3,"C",20073,"['MWF 1255-0150PM']","","Research",2007,33
"237",57797,1,177,"['AMCON']","In this century of institutional development, national expansion, and sectional conflict, Americans continued to define a national identity. Students probe the ways in which region, religion, race, ethnicity, and gender inform individual and group contributions to the conversation. They also analyze how geographical expansion and ideas of progress influenced different visions and versions of America. Topics and texts include Transcendentalist writers, the Second Great Awakening, Black Elk Speaks, landscape painting, and Western photography.","",NA,"",NA,"['Steven C. Hahn']",100,"['RML 515']","Dem Vistas: 1800-1900","",102,"False","False","A",3,"C",20073,"['MWF 1255-0150PM']","Democratic Vistas, 1800-1900","Research",2007,21
"238",57798,1,177,"['AMCON']","In this century of institutional development, national expansion, and sectional conflict, Americans continued to define a national identity. Students probe the ways in which region, religion, race, ethnicity, and gender inform individual and group contributions to the conversation. They also analyze how geographical expansion and ideas of progress influenced different visions and versions of America. Topics and texts include Transcendentalist writers, the Second Great Awakening, Black Elk Speaks, landscape painting, and Western photography.","",NA,"",NA,"['Colin Wells']",100,"['RML 420']","Dem Vistas: 1800-1900","",102,"False","False","B",3,"C",20073,"['MWF 1255-0150PM']","Democratic Vistas, 1800-1900","Research",2007,18
"240",57803,1,164,"['BIO']","The last decade has unveiled the mechanism by which a single cell gives rise to an embryo rich in pattern and cellular diversity. This course traces the use of surgical, genetic, and molecular techniques as they have uncovered the developmental blueprints encoding the universal body plan fundamental to all metazoan life. Students attend lectures plus one 3-hour laboratory per week. Prerequisites: Biology 125 and 126, or Chemistry/Biology 125-127 and Biology 126, and Biology 233.","",164,"",NA,"['Eric Cole']",300,"['SC 274', 'SC 274']","Developmental Biology","Students in Bio 372 must also register for lab Bio 372 L. Open to Juniors and Seniors only.",372,"False","Prerequisites: Biology 125 and 126, or Chemistry/Biology 125-127 and Biology 126, and Biology 233.","",3,"O",20073,"['T 0935-1100', 'Th 0930-1050']","","Research",2007,17
"326",57955,1,499,"['ID']","This course provides an examination and application of the key content, skills, and perspectives of human geography. The lens of the geographer focuses on the spatial distribution of phenomena over the surface of the earth, asking the questions ""where"" and ""why there."" The practices and skills of geography are used to investigate a variety of issues in the Middle East, including environmental problems, the culture and management of sacred places, and the reasons for war and the need for peace.","",NA,"",NA,"['Robert W. McClure']",200,"['Mod 4', 'Mod 4']","Human Geography","",234,"False","False","",3,"C",20073,"['T 0120-0245PM', 'Th 0215-0335PM']","Human Geography of the Middle East","Research",2007,35
"330",57959,1,16962,"['ASIAN']","The Universal Declaration of Human Rights proclaims that ""the inherent dignity and ... the equal and inalienable rights of all members of the human family [are] the foundation of freedom, justice and peace in the world."" Who speaks to human rights in East Asia? What ethical perspectives are voiced? Case studies presented through memoirs, films, reports, and multidisciplinary analyses provide the material for exploring diverse normative claims about individual rights in East Asia. Prerequisites: Asian Studies 275 or permission of the instructor and completion of BTS-T. Offered annually.","",NA,"",NA,"['Katherine S. Tegtmeyer Pak']",300,"['HH 515', 'HH 515']","Human Rights/AsianContext","Prerequisite: Completion of BTS-T requirement. This course has class year limits.",397,"False","Prerequisites: Asian Studies 275 or permission of the instructor and completion of BTS-T. Offered annually.","",3,"C",20073,"['T 0935-1100', 'Th 0930-1050']","Seminar: Human Rights/Asian Context","Research",2007,15
"331",57960,1,651,"['FAMST']","This course explores the varied dimensions of human sexuality as they relate to, affect and are affected by past and present human relationships. Sexual problems and issues are re-examined for the development of personal value framework and for the enrichment of family life. The course emphasizes critical thinking skills applied to current issues in human sexuality (e.g. gay marriage, gender issues, sexual violence). Students examine issues in contemporary research and ethics in sexuality.","",NA,"",NA,"['Sharon Powell']",200,"['HH 501', 'HH 501']","Human Sexuality","This course has class year limits.",253,"False","False","",3,"C",20073,"['T 0120-0245PM', 'Th 0215-0335PM']","","Research",2007,44
"378",58013,1,1326,"['SPAN']","Through exploring the geographic and human diversity of the Spanish-speaking world, students develop increasingly complex skills for analyzing and communicating in Spanish. They study such essential dimensions of that world as: (1) geography and development; (2) environmental challenges and solutions; (3) population and demographic changes and challenges; and (4) ethnic diversity. Prerequisite: Spanish 112 or placement. Offered Fall, Interim, and Spring Semesters.","",NA,"",NA,"['Barbara Olson']",200,"['OM 021']","Intermed Spanish I","",231,"False","Prerequisite: Spanish 112 or placement. Offered Fall, Interim, and Spring Semesters.","B",3,"C",20073,"['MWF 1045-1140']","Intermediate Spanish I","Research",2007,16
"379",58014,1,1326,"['SPAN']","Through exploring the geographic and human diversity of the Spanish-speaking world, students develop increasingly complex skills for analyzing and communicating in Spanish. They study such essential dimensions of that world as: (1) geography and development; (2) environmental challenges and solutions; (3) population and demographic changes and challenges; and (4) ethnic diversity. Prerequisite: Spanish 112 or placement. Offered Fall, Interim, and Spring Semesters.","",NA,"",NA,"['Gemma Punti']",200,"['OM 020']","Intermed Spanish I","",231,"False","Prerequisite: Spanish 112 or placement. Offered Fall, Interim, and Spring Semesters.","C",3,"C",20073,"['MWF 1150-1245PM']","Intermediate Spanish I","Research",2007,20
"380",58015,1,1326,"['SPAN']","Through exploring the geographic and human diversity of the Spanish-speaking world, students develop increasingly complex skills for analyzing and communicating in Spanish. They study such essential dimensions of that world as: (1) geography and development; (2) environmental challenges and solutions; (3) population and demographic changes and challenges; and (4) ethnic diversity. Prerequisite: Spanish 112 or placement. Offered Fall, Interim, and Spring Semesters.","",NA,"",NA,"['Gemma Punti']",200,"['OM 021']","Intermed Spanish I","",231,"False","Prerequisite: Spanish 112 or placement. Offered Fall, Interim, and Spring Semesters.","D",3,"C",20073,"['MWF 1255-0150PM']","Intermediate Spanish I","Research",2007,19
"401",58042,1,1289,"['SOAN']","This course helps students explore the connections between society and their own lives. Students answer challenging questions such as ""Do we have a 'human nature'?,"" ""Why does social inequality exist?,"" ""What is race?,"" and ""How do societies change?"" In answering these questions students learn to develop a sociological imagination. In doing so they review the various research methods and theories that form the sociological tradition. This course is primarily open to first year students or students in certain accredited programs. Offered both semesters.","",NA,"",NA,"['Bruce Nordstrom-Loeb']",100,"['RML 525']","Intro to Sociology","Open to first-year students only.",121,"False","False","A",3,"C",20073,"['MWF 1255-0150PM']","Introduction to Sociology","Research",2007,36
"402",58043,1,1289,"['SOAN']","This course helps students explore the connections between society and their own lives. Students answer challenging questions such as ""Do we have a 'human nature'?,"" ""Why does social inequality exist?,"" ""What is race?,"" and ""How do societies change?"" In answering these questions students learn to develop a sociological imagination. In doing so they review the various research methods and theories that form the sociological tradition. This course is primarily open to first year students or students in certain accredited programs. Offered both semesters.","",NA,"",NA,"['Bruce Nordstrom-Loeb']",100,"['RML 525']","Intro to Sociology","Open to first-year students only.",121,"False","False","B",3,"C",20073,"['MWF 0200-0255PM']","Introduction to Sociology","Research",2007,19
"404",58046,1,1476,"['WMNST']","Required for the women's studies major and concentration, this course introduces students to the concept of gender as a category of analysis. It is designed for students who seek a fuller understanding of themselves as women and men and a wider knowledge of the experiences and achievements of women.","",NA,"",NA,"['Anna Kuxhausen']",100,"['DC 204', 'DC 204']","Intro Women's Studies","",121,"False","False","",3,"C",20073,"['T 0935-1100', 'Th 0930-1050']","Introduction to Women's Studies","Research",2007,19
"527",58197,1,409,"['ENGL']","These courses treat specific periods in American literature and examine the relationship between literary texts and movements and their particular cultural, political, and historical contexts. Each offering of this course examines a different literary era and emphasizes specific literary and historical issues. Students may register for the course more than once provided a different era is studied. Prerequisite: FYW or equivalent. ---------------------------------------------------------------------------------------------------- Early American Literature focuses upon the literature of the colonial and early national periods, as in works by Bradstreet, Edwards, Franklin, Wheatley, and Equiano, in the context of America's Puritan origins, democratic revolutions, and uneasy relations with native peoples. ---------------------------------------------------------------------------------------------------- 19th-Century American Literature examines literary works by authors such as Whitman, Dickinson, Twain, James, Douglass, and Wharton in the context of emergence of modern individualism, industrialism and immigration, and the struggles for the rights of women and African Americans. ---------------------------------------------------------------------------------------------------- Modern American Literature examines literary movements and works in 20th-century America, such as those by Frost, Eliot, Cather, Faulkner, Hurston, Ginsberg, Plath, and Morrison, in such contexts as the world wars, economic depression and experiences, and alienation of different cultures and generations. ----------------------------------------------------------------------------------------------------","",NA,"",NA,"['J. Susannah Shmurak']",200,"['RML 421', 'RML 421']","Literary Eras: Amer","",240,"False","Prerequisite: FYW or equivalent. ---------------------------------------------------------------------------------------------------- Early American Literature focuses upon the literature of the colonial and early national periods, as in works by Bradstreet, Edwards, Franklin, Wheatley, and Equiano, in the context of America's Puritan origins, democratic revolutions, and uneasy relations with native peoples. ---------------------------------------------------------------------------------------------------- 19th-Century American Literature examines literary works by authors such as Whitman, Dickinson, Twain, James, Douglass, and Wharton in the context of emergence of modern individualism, industrialism and immigration, and the struggles for the rights of women and African Americans. ---------------------------------------------------------------------------------------------------- Modern American Literature examines literary movements and works in 20th-century America, such as those by Frost, Eliot, Cather, Faulkner, Hurston, Ginsberg, Plath, and Morrison, in such contexts as the world wars, economic depression and experiences, and alienation of different cultures and generations. ----------------------------------------------------------------------------------------------------","",3,"O",20073,"['T 0120-0245PM', 'Th 0215-0335PM']","Literary Eras: American","Research",2007,15
"569",58251,1,1303,"['SOAN']","Southeast Asia is a diverse region, stretching from the sleek high-rises of Singapore to hermetic Rangoon; from Islam to Buddhism; from computer chip manufacture to swidden agriculture. Students read ethnographies, novels, and local histories to better understand Southeast Asian family life, religion, language, and education. Through focusing on the experience of modernity, students examine how Southeast Asians make sense of their group affiliations, their pasts and their futures. The course aims to challenge contemporary understandings of place, entitlement, and home both in Southeast Asia and beyond. Offered Fall or Spring Semester.","",NA,"",NA,"['Thomas A. Williamson']",200,"['HH 307', 'HH 307']","Modern Southeast Asia","",239,"False","False","",3,"C",20073,"['T 1145-0110PM', 'Th 1245-0205PM']","","Research",2007,29
"587",58296,1,1064,"['ESTH']","Students study in-depth the physiology of exercise, covering cardiovascular and muscular adaptions to exercise and factors affecting performance, including body composition, environmental influences, training implications across gender and age, and the assessment of fitness. The course includes a laboratory component. Prerequisite: junior standing and Biology 123, or consent of instructor.","",1064,"",NA,"['Christine Daymont']",300,"['SAC 103']","Physiology/Exercise","",375,"False","Prerequisite: junior standing and Biology 123, or consent of instructor.","",3,"O",20073,"['MWF 1045-1140']","Physiology of Exercise","Research",2007,23
"649",58392,1,632,"['HIST']","This seminar covers various topics in modern European history, depending upon the instructor. Recent topics have included ""The Holocaust and History,"" ""Race, Gender, and Medicine,"" and ""Stalin."" Offered most years. May be repeated if topics are different.","",NA,"",NA,"['Anna Kuxhausen']",300,"['HH 514', 'HH 514']","Sem: Modern Russia","",320,"False","False","",3,"C",20073,"['T 0120-0245PM', 'Th 0215-0335PM']","Seminar: Modern Europe","Seminar",2007,21
"652",58395,1,1481,"['WMNST']","The course provides a capstone to the major. Taught as a seminar, it offers an opportunity for students to integrate their studies of women across disciplines and to become more aware of the intricate web of gender, race, culture, and class that informs women's experiences. Prerequisite: Women's Studies 121.","",NA,"",NA,"['Anne G. Sabo']",300,"['BMC 109']","Sem: Discourses Gender","",399,"False","Prerequisite: Women's Studies 121.","",3,"C",20073,"['MWF 1045-1140']","Advanced Topics in Women's Studies","Seminar",2007,13
"661",58410,1,563,"['HIST']","This seminar, using only eyewitness accounts, examines African slavery in the United States, the Caribbean, and Latin America. Typical readings include the narrative of Frederick Douglass, Harriet Jacobs' autobiography, and the writings of slave-holders like Mary Chesnut. Topics include the slave trade, the origins of African-American culture, women and slavery, and the origins of the Civil War. The course concludes with an examination of the process of emancipation. Offered periodically.","",NA,"",NA,"['Michael Fitzgerald']",100,"['HH 515']","Slavery/Americas","Open to first-year students only.",165,"False","False","",3,"C",20073,"['MWF 0800-0855']","Slavery in the Americas","Research",2007,18
"662",58412,1,1363,"['SWRK']","Immigration policy and welfare reform exemplify how society's values and needs translate into policies and programs. Social workers work for justice by creating, implementing and evaluating policies in health, employment, housing and child welfare. Students study policy formation and analysis that reflect interests and powers of diverse groups as well as economic and social needs of certain populations at risk, especially women, the poor, African-Americans, gay men and lesbians and Latinos. Open to non-majors by permission of program director. Offered Spring Semester.","",NA,"",NA,"['Mary Carlsen']",200,"['HH 403']","Social Policy","This course has class year limits.",258,"False","False","",3,"C",20073,"['MWF 1150-1245PM']","","Research",2007,35
"703",58480,1,1301,"['SOAN']","Focusing on present day Arab and Middle Eastern countries, the course explores the role of the institutions of family and religion in maintaining continuity, while also identifying sources of change such as the colonial experience, regional and global interdependence, the social impact of oil, fundamentalist movements, and the co-existence of traditional and ""modern"" values. Offered Spring Semester.","",NA,"",NA,"['Samiha Peterson']",200,"['HH 403', 'HH 403']","The Arab World","",236,"False","False","",3,"C",20073,"['T 0120-0245PM', 'Th 0215-0335PM']","","Research",2007,29
"734",58788,1,1482,"['ARMS']","This course provides an introduction to the cultural and historical background of four groups in the United States: African Americans, Native Americans, Latinos and Asian Americans. Emphasis is on race relations and the distinguishing characteristics of these cultures as reflected in the academic disciplines of the creative and performing arts, the humanities, the social and behavioral sciences and the general area of popular culture. Contributions to cultural pluralism are accentuated as well as the special issues of identity faced by these Americans. This course emphasizes literary texts.","",NA,"",NA,"['Joan Hepburn']",100,"['RML 421', 'RML 421']","Intro to Arms","",121,"False","False","",3,"C",20073,"['T 0935-1100', 'Th 0930-1050']","Introduction to American Racial and Multicultural Studies","Research",2007,30
"757",58918,1,429,"['ENGL']","Students explore various forms of prose, both fiction and nonfiction. Each instructor selects different material to be studied and emphasizes various aspects of the form. Topics can range from the 18th-century novel to African American autobiography. May be repeated if topics are different. Prerequisite: FYW or equivalent.","",NA,"",NA,"['Jenny Dunning']",200,"['RML 515', 'RML 515']","Top: Chekhov's Legacy","This course does NOT fulfill ORC.",283,"False","Prerequisite: FYW or equivalent.","A",3,"O",20073,"['T 0800-0925', 'Th 0800-0920']","Studies in Prose","Topic",2007,10
"758",58919,1,429,"['ENGL']","Students explore various forms of prose, both fiction and nonfiction. Each instructor selects different material to be studied and emphasizes various aspects of the form. Topics can range from the 18th-century novel to African American autobiography. May be repeated if topics are different. Prerequisite: FYW or equivalent.","",NA,"",NA,"['Diana Postlethwaite']",200,"['RML 525']","Top: 19th-21st C Novels","This course does NOT fulfill ORC.",283,"False","Prerequisite: FYW or equivalent.","B",3,"C",20073,"['MWF 1150-1245PM']","Studies in Prose","Topic",2007,26
"783",58947,1,605,"['HIST']","An overview of the evolution of Latin American societies since 1750, this course examines the consequences of independence, 19th-century economic imperialism, and the 20th-century transitions to more urbanized, industrialized ways of life. Students examine major Latin American nations and compare their revolutionary and counter-revolutionary trajectories toward the establishment of authoritarian states. Applied Foreign Language Component available in Spanish. Offered most years.","",NA,"",NA,"['Jeane DeLaney']",200,"['OM 011']","Modern Latin America","",242,"False","False","",3,"O",20073,"['MWF 0200-0255PM']","","Research",2007,26
"796",58962,1,1132,"['PSCI']","How do the peoples of Latin America participate politically? How do domestic politics interact with national and international economics? How do states treat challenges posed by migration and by desires for ""modernization"" and democracy in a context of authoritarian legacy and debt? Students examine how Latin American politics work, focusing on Mexico, parts of Central America, the Caribbean, the Andean Region, and the Southern Cone.","",NA,"",NA,"['Kristina Thalhammer']",200,"['HH 317', 'HH 317']","Latin Am Politics","",264,"False","False","",3,"O",20073,"['T 0935-1100', 'Th 0930-1050']","Latin American Politics","Research",2007,19
"798",58964,1,1103,"['PSCI']","The promise of American politics is the equal freedom of all. How does practice match principles? What roles do class and race play? Do interest groups and political parties foster democracy? This course is designed not only to help students understand American government and politics but also to motivate them to be active and informed participants. Offered annually.","",NA,"",NA,"['Jonathan Peterson']",100,"['DC 305', 'DC 305']","American Politics","",111,"False","False","",3,"C",20073,"['T 0120-0245PM', 'Th 0215-0335PM']","","Research",2007,30
"807",58973,1,1311,"['SOAN']","This course compares gender patterns and issues in various cultures around the world, such as Latin America, the Middle East, India, the U.S., and East Asia. How do cultural expectations for women and men vary? Why do some societies have more gender equality than others? How do economic and political change, including globalization, impact gender roles? How do U.S. and Third World feminism compare? Offered Fall or Spring Semester.","",NA,"",NA,"['Bruce Nordstrom-Loeb']",200,"['HH 307']","Gender/C-Cult/Persp","",261,"False","False","",3,"C",20073,"['MWF 1045-1140']","Gender in Cross-Cultural Perspective","Research",2007,42
"808",58974,1,1310,"['SOAN']","This course provides a social science understanding of the ""contemporary American family"" and analysis of marriage and family issues from a cross-cultural perspective. Students discuss issues of dating and mate selection, marital and parent-child relationships over the family life cycle, gender issues, work and family roles, and problem-related issues affecting families (divorce, violence and death) caused by rapid changes in society. Offered Fall or Spring Semester.","",NA,"",NA,"['Ryan R. Sheppard']",200,"['HH 307', 'HH 307']","Marriage & the Family","",260,"False","False","A",3,"C",20073,"['T 0800-0925', 'Th 0800-0920']","Marriage and the Family","Research",2007,27
