"","clbid","credits","crsid","departments","description","gereqs","groupid","instructors","level","locations","name","notes","number","pn","prerequisites","section","semester","status","term","times","title","type","year","enrolled"
"109",57187,1,1338,"['SPAN']","Students analyze patterns of continuity and change in Spain, Latin America, and/or the Hispanic U.S. Using readings from the press, academic sources, and governmental as well as non-governmental documents, students read, discuss, and write about issues at an advanced level of linguistic and analytical sophistication. The course includes study of at least one substantive literary work. Possible themes include love, family and marriage, or crossing borders and the challenges of migration. Taught in Spanish. Prerequisite: Spanish 250.","",NA,"['Gwendolyn Barnes-Karol']",200,"['OM 020']","Contemporary Issues","Open to all students who meet the requirements.",274,"False","Prerequisite: Spanish 250.","",2,"C",20072,"['M-F 1040-0300PM']","Contemporary Issues in the Spanish-Speaking World","Research",2007,15
"113",57223,1,18485,"['SOAN']","This course explores the lives of gay, lesbian, bisexual, and transgender people from several social science perspectives. We'll look at whether gender and sexual orientation (both heterosexual and homosexual) are socially constructed or biologically natural, and what cross-cultural and historical examples can tell us. We'll look at controversies over the family and religious status of GLBT people, why homosexuality has become such a political issue, and movements for change. Offered during Interim.","",NA,"['Bruce Nordstrom-Loeb']",200,"['HH 307']","GLBT Lives and Issues","",246,"False","False","",2,"C",20072,"['M-F 1040-1240PM']","","Research",2007,30
"118",57237,1,1329,"['SPAN']","Students explore geographic, economic, political and ethnic dimensions of life in Costa Rica by combining intensive course work with such cross-cultural experiences as a homestay in San Jose, field work, visits to sites of cultural interest, and excursions to the Atlantic and Pacific coasts. They consolidate their language skills and continue to develop their skills for analyzing and communicating in Spanish through compositions, oral presentations, and interviews of Costa Ricans. Prerequisite: Spanish 231 or placement. Offered only during Interim.","",NA,"['Maggie Broner']",200,"","Inter Span II-C Rica","",234,"False","Prerequisite: Spanish 231 or placement. Offered only during Interim.","",2,"C",20072,"","Intermediate Spanish II in Costa Rica","Research",2007,22
"119",57238,1,1328,"['SPAN']","Students explore geographic, economic, political, and ethnic dimensions of life in present-day Ecuador by combining intensive course work with such cross-cultural experiences as a homestay in Quito, interactions with students, and field trips to indigenous communities in Otavalo and the Amazon region east of Tena. They consolidate their language skills and continue to develop their skills for analyzing and communicating in Spanish through compositions, oral presentations, and interviews of Ecuadorians. Prerequisite: Spanish 231or placement. Offered only during Interim.","['MCG']",NA,"['Kris A. Cropsey']",200,"","Inter Span II-Ecuador","",233,"False","Prerequisite: Spanish 231or placement. Offered only during Interim.","",2,"C",20072,"","Intermediate Spanish II in Ecuador","Research",2007,22
"120",57243,1,1326,"['SPAN']","Through exploring the geographic and human diversity of the Spanish-speaking world, students develop increasingly complex skills for analyzing and communicating in Spanish. They study such essential dimensions of that world as: (1) geography and development; (2) environmental challenges and solutions; (3) population and demographic changes and challenges; and (4) ethnic diversity. Prerequisite: Spanish 112 or placement. Offered Fall, Interim, and Spring Semesters.","",NA,"['Barbara Olson']",200,"['OM 031', 'OM 031']","Intermed Spanish I","Open to all students who meet the requirements.",231,"False","Prerequisite: Spanish 112 or placement. Offered Fall, Interim, and Spring Semesters.","",2,"O",20072,"['M-F 1040-1140', 'M-F 0100-0300PM']","Intermediate Spanish I","Research",2007,13
"220",57362,1,481,"['FREN']","Students study the French language and French-Caribbean culture on the island of Martinique in an immersion experience that includes home stays. The course emphasizes the multicultural aspects of the region and facilitates student interaction with the local population. Field trips and other cultural activities complement instruction, which is carried out at the Université des Antilles. Taught in French. Prerequisite: French 231 or 232, or placement into French 232. Open to first-year students. Offered only during Interim.","",NA,"['Herve Pensec']",200,"","Lang/Cul Fr Caribbean","Open to all students who meet the requirements.",233,"False","Prerequisite: French 231 or 232, or placement into French 232. Open to first-year students. Offered only during Interim.","",2,"C",20072,"","Language and Culture Studies in The French Caribbean","Research",2007,18
"221",57366,1,405,"['ENGL']","These courses treat specific periods in British literature and examine the relationship between literary texts and movements and their particular cultural, political, and historical contexts. Each offering of this course examines a different literary era and emphasizes specific literary and historical issues. Students may register for the course more than once provided a different era is studied. Prerequisite: FYW or equivalent. ---------------------------------------------------------------------------------------------------- The Middle Ages focuses upon Anglo-Saxon and Middle English literature, including the Beowulf poet, Chaucer, Julian of Norwich, and Malory, in the context of emerging ideas such as heroism, the role of women, and the relationship between secular society and the Church. ---------------------------------------------------------------------------------------------------- The Renaissance examines radical literary changes in English literature, as they occur in Spenser, Shakespeare, Lanyer, Donne, and Milton, in such contexts as the Protestant Reformation and strife over Puritanism, court politics under Elizabeth and James, and the English Civil War. ---------------------------------------------------------------------------------------------------- The Age of Englightenment focuses upon neoclassical poetry and satire and the emergence of the novel. Writers such as Dryden, Behn, Swift, Pope, and Fielding are read in the context of political and social revolutions, the African slave trade, and the growth of modern capitalism. ---------------------------------------------------------------------------------------------------- The Romantic Period considers the outburst of literary creativity in such poets as Blake, Wordsworth, Coleridge, Byron, Shelley, and Keats and such prose writers as Wollstonecraft, Scott, Austen, and Mary Shelley, in the context of revolutionary politics, encounters with nature and the rise of industrialized, consumer capitalism. ---------------------------------------------------------------------------------------------------- The Victorian Period, a time of British political and cultural dominance, examines the work of such writers as Tennyson, Robert and Elizabeth Barrett Browning, Dickens, and the Brontës, in the context of scientific, industrial and colonial growth, religious skepticism, and challenges to class and gender inequalities. ---------------------------------------------------------------------------------------------------- Modern British Literature focuses on the literature reflecting modern turbulence, innovation, and alienation, as in Joyce, Lawrence, Woolf, and Eliot, in the context of World War, social and economic crises, and radical artistic experimentalism.","",NA,"['Jonathan Hill']",200,"['RML 515']","Literary Eras: Romantics","Open to all students who have completed FYW or equivalent.",230,"False","Prerequisite: FYW or equivalent. ---------------------------------------------------------------------------------------------------- The Middle Ages focuses upon Anglo-Saxon and Middle English literature, including the Beowulf poet, Chaucer, Julian of Norwich, and Malory, in the context of emerging ideas such as heroism, the role of women, and the relationship between secular society and the Church. ---------------------------------------------------------------------------------------------------- The Renaissance examines radical literary changes in English literature, as they occur in Spenser, Shakespeare, Lanyer, Donne, and Milton, in such contexts as the Protestant Reformation and strife over Puritanism, court politics under Elizabeth and James, and the English Civil War. ---------------------------------------------------------------------------------------------------- The Age of Englightenment focuses upon neoclassical poetry and satire and the emergence of the novel. Writers such as Dryden, Behn, Swift, Pope, and Fielding are read in the context of political and social revolutions, the African slave trade, and the growth of modern capitalism. ---------------------------------------------------------------------------------------------------- The Romantic Period considers the outburst of literary creativity in such poets as Blake, Wordsworth, Coleridge, Byron, Shelley, and Keats and such prose writers as Wollstonecraft, Scott, Austen, and Mary Shelley, in the context of revolutionary politics, encounters with nature and the rise of industrialized, consumer capitalism. ---------------------------------------------------------------------------------------------------- The Victorian Period, a time of British political and cultural dominance, examines the work of such writers as Tennyson, Robert and Elizabeth Barrett Browning, Dickens, and the Brontës, in the context of scientific, industrial and colonial growth, religious skepticism, and challenges to class and gender inequalities. ---------------------------------------------------------------------------------------------------- Modern British Literature focuses on the literature reflecting modern turbulence, innovation, and alienation, as in Joyce, Lawrence, Woolf, and Eliot, in the context of World War, social and economic crises, and radical artistic experimentalism.","",2,"C",20072,"['M-F 1040-1240PM']","Literary Eras: British","Research",2007,35
"225",57377,1,338,"['EDUC']","Students examine the influence of race, class and multiculturalism in American schools by participating as teachers' assistants and tutors in two distinctly different K-12 settings. Through guest lectures, readings, field trips and seminars, students explore the unique geography and culture of the Hawaiian Islands and develop a framework for examining diversity on the mainland. Prerequisite: Education 290, 2.5 GPA, meeting all off-campus study requirements and satisfactory portfolio progress. Fulfills Education 382 and partially fulfills field experience requirements. Students apply in the Spring Semester. Counts toward the major: American Racial and Multicultural Studies. P/N only. Offered annually during Interim.","",NA,"['Mark Schelske']",300,"","Multi-Cult Ed Hawaii","",378,"True","Prerequisite: Education 290, 2.5 GPA, meeting all off-campus study requirements and satisfactory portfolio progress. Fulfills Education 382 and partially fulfills field experience requirements. Students apply in the Spring Semester. Counts toward the major: American Racial and Multicultural Studies. P/N only. Offered annually during Interim.","",2,"C",20072,"","Multicultural Education in Hawaii: Seminar and Practicum","Research",2007,20
"228",57383,1,85,"['ASIAN']","In this Interim course, students who have completed the Asian Conversations sequence travel to sites in China and Japan in order to experience those cultures firsthand and to study Chinese and Japanese constructions of national identity. Through readings, site visits, interactions with peers in the target languages, homestays, and journal writing in both English and their target language, students learn about how Asians in these two countries perceive themselves and their role in the region and in the world, both in the past and in the present. Prerequisite: Asian Studies 21 or permission of the instructor. Offered for the last time in Interim 2008.","",NA,"['Katherine S. Tegtmeyer Pak']",200,"","Nat ID/China & Japan","",212,"False","Prerequisite: Asian Studies 21 or permission of the instructor. Offered for the last time in Interim 2008.","",2,"C",20072,"","Asian Conversations: National Identity in China and Japan","Research",2007,20
"247",57418,1,565,"['HIST']","On the basis of selected works of O.E. Rølvaag, including Giants in the Earth, this course considers the literature and history of Norwegian America in the later 19th and early 20th centuries. For the sake of comparison students also read selections from other Norwegian and Norwegian-American authors. Topics for consideration include ecology, family, gender, agriculture, economics, technology, urbanization, religion, immigration, ethnicity, and American pluralism. Offered periodically.","",NA,"['Todd W. Nichol']",100,"['RML 421']","Rolvaag's America","Open to first-year students only.",168,"False","False","",2,"C",20072,"['M-F 1040-1240PM']","Rølvaag's America","Research",2007,18
"255",57428,1,308,"['EDUC']","Through lectures, readings and field placements in Minneapolis, students gain an understanding of how race, class, ethnicity, national origin, gender, sexual orientation and religion, shape the character of urban youth and communities. Students spend the first week on campus in preparation for their placements and the last week reflecting upon their experiences. During weeks two and three students live in Minneapolis, tutor in the schools and participate in various after-school activities. Counts toward the major: American Racial and Multicultural Studies. Fulfills Education 382. P/N only. Offered annually during Interim.","",NA,"['Heather Campbell']",100,"","Schools & Communities","Open to First-Year Students and Sophomores only. Admission by interview.",170,"True","False","",2,"C",20072,"","Urban Schools and Communities","Research",2007,18
"265",57472,1,382,"['ENGL']","Students examine various heroic and trickster figures as manifested in post-colonial literature from Africa, Asia, and the Caribbean, both oral and written, and seek to understand what basic human needs and realities these figures express and fulfill.","",NA,"['Joseph L. Mbele']",100,"['RML 421']","Trickstr/Post-Col Lit","",108,"False","False","",2,"C",20072,"['M-F 0100-0300PM']","The Hero and the Trickster in Post-Colonial Literature","Research",2007,31
"266",57479,1,339,"['EDUC']","Students work full-time as tutors and teacher aides in Minneapolis and St. Paul public schools. They are expected to participate in the co-curricular life of the school and surrounding community. This course is designed to heighten students' sensitivities to the complexities of educating urban youth in a multicultural setting. Prerequisite: Education 290, 2.5 GPA, meeting all off-campus study requirements. The course fulfills Education 382 and partially fulfills field experience requirements. Counts toward the major: American racial and multicultural studies. Applications due by Oct. 15. P/N only. Offered annually during Interim.","",NA,"['Rosemary A. Pfarr-Baker']",300,"","Urban Sem & Practicum","Admission by interview.",379,"True","Prerequisite: Education 290, 2.5 GPA, meeting all off-campus study requirements. The course fulfills Education 382 and partially fulfills field experience requirements. Counts toward the major: American racial and multicultural studies. Applications due by Oct. 15. P/N only. Offered annually during Interim.","",2,"C",20072,"","Urban Education Practicum and Seminar","Research",2007,20
"268",57490,1,606,"['HIST']","This course examines the history of 20th-century Cuba, especially the 1959 revolution and its aftermath. Students study the transformation of Cuban political culture, the obstacles to economic and agrarian reform, education, the role of women, human rights, U.S. policies toward Cuba, and the future of Cuba after the breakup of the Soviet Union. The role of charismatic leadership in Latin America and the possibilities for revolutionary changes in the Americas are also examined. Offered periodically during Interim.","",NA,"['Jeane DeLaney']",200,"['HH 317']","20th Century Cuba","",243,"False","False","",2,"C",20072,"['M-F 0100-0300PM']","20th-Century Cuba","Research",2007,31
"273",58824,1,367,"['DANCE']","An introduction to world dance traditions, this course examines dance forms, functions, contexts, and differing aesthetics found in selected cultures of Africa, Asia, Europe, the Near and Middle East, the South Pacific, and Latin America. The course includes lectures, discussions, video-viewing, and required field-trips to dance events, in addition to studio experiences where students learn dances from the cultures studied. No previous dance experience required. Offered during Interim 2008 and alternate years.","",NA,"['Anne von Bibra']",100,"['DC Studio 1', 'DC 204']","World Dance Tradition","",124,"False","False","",2,"C",20072,"['MTThF 0100-0300PM', 'MTThF 1040-1200PM']","World Dance Traditions","Research",2007,22
"282",58873,1,16366,"['PSYCH']","Students reflect on their own culture as they explore childhood and family life in China and Japan. Developmental and cross-cultural research, memoirs, works of fiction, and films are used to study parents' beliefs and childrearing practices as well as the development of the self, peer relationships, school achievement, and role changes during adulthood. With life expectancy increasing around the world, students also discover how China and Japan are responding to the graying of their populations. Prerequisites: Psychology 125 or Asian Studies 121, 211, or 212. Offered during Interim.","",NA,"['Dana Gross']",200,"['HH 317']","Human Dev/China and Japan","Open to all students who have fulfilled the prerequisite.",226,"False","Prerequisites: Psychology 125 or Asian Studies 121, 211, or 212. Offered during Interim.","",2,"C",20072,"['M-F 1040-1240PM']","Human Development in East Asia: Perspectives from China and Japan","Research",2007,27
"293",59140,1,924,"['NORW']","This film course focuses on the increasingly non-traditional ways of forming relationships in the Nordic countries. Rejecting the values of previous generations, young people from different backgrounds and ethnicities form relationships according to their own integrity and sexual preferences. Students attain an understanding of these cultural trends and the technical terminology to watch, read, think, talk, and write critically and intelligently about films as text. Taught in English.","",NA,"['Anne G. Sabo']",100,"['HH 501']","Nordic Film Today","",130,"False","False","",2,"O",20072,"['M-F 0100-0400PM']","Nordic Film Today: Love, Sex, and Family","Research",2007,17
"294",59141,1,1219,"['REL']","Through visits to the area around Cape Town and Johannesburg/Pretoria, this course examines cultural diversity in South Africa and the important role religion has played in shaping and sustaining the identity of various ethnic and racial groups. Study of the way religious ideas were used to defend the apartheid system and also to justify protest against it. Analysis of organizations, post-apartheid, to build a multi-racial democracy and a just social order. Prerequisite: BTS-B. Offered Interim 2007-08","",NA,"['Eric Lund']",200,"","Rel of South Africa","",251,"False","Prerequisite: BTS-B. Offered Interim 2007-08","",2,"C",20072,"","Religion and Cultural Diversity in South Africa","Research",2007,24
"298",59571,1,559,"['HIST']","This seminar examines the Vietnam War in the larger context of Vietnamese history and focusing on the Vietnamese side of history. Themes include the heritage of Vietnamese civilization, French conquest and colonial rule, nationalism and its relationship to Communism, the emergence of two Vietnamese states, and the causes and consequences of the Vietnam War. This course also addresses questions about ideology, the role of the United States in Asia, and the historical processes of nationalism and Communism. Offered during Interim.","",NA,"['Robert Entenmann']",100,"['HH 302']","Vietnam","Open to first-year students only.",135,"False","False","",2,"C",20072,"['M-F 0100-0300PM']","Nationalism and Revolution in Vietnam","Research",2007,19
"303",60464,1,18758,"['EDUC']","Students spend sixteen days working as teaching assistants in a New York City school and four days observing various innovative Manhattan schools. Through readings, guest speakers, and hands-on experience, students will learn about the challenges and rewards of working in a diverse school environment. Prerequisites: Education 290, 2.50 GPA, and satisfactory field placement experience. Fulfills Education 382 and partially fulfills field experience requirement. Students apply in the Spring Semester. Counts toward the major: American Racial and Multicultural Studies. P/N only. Offered during alternate Interims.","",NA,"['Daniel R. Forstner']",300,"","NYC Education Practicum","",377,"True","Prerequisites: Education 290, 2.50 GPA, and satisfactory field placement experience. Fulfills Education 382 and partially fulfills field experience requirement. Students apply in the Spring Semester. Counts toward the major: American Racial and Multicultural Studies. P/N only. Offered during alternate Interims.","",2,"C",20072,"","New York City Education Seminar and Practicum","Research",2007,24
"312",60892,1,1681,"['ENGL']","The history of British colonization of America, Africa, Asia, and Australia coincides with the history of the novel's emergence as the major literary genre in English. This course examines this parallel history by considering the ways in which the colonial experience has been represented in novels from the 18th century to the present. We will read six novels, tracing this development in America, Africa, and Asia, and discuss the novels both in relationship to the development of the novel in general, and to their place in colonial or postcolonial history. Offered during Interim.","",NA,"['Colin Wells']",200,"['RML 577']","Colonialism and the Novel","Open to all students who have completed FYW or equivalent.",209,"False","False","",2,"O",20072,"['M-F 1040-1240PM']","Colonialism and the Novel.","Research",2007,16
