"","clbid","credits","crsid","departments","description","gereqs","groupid","grouptype","halfcredit","instructors","level","locations","name","notes","number","pn","prerequisites","section","semester","status","term","times","title","type","year","enrolled"
"768",80804,1,616,"['HIST']","This course surveys women's experience in American life from the colonial period to the present. Students examine the changing economic, social, and legal status of women, society's attitudes towards women, and the growth of a women's movement. Offered most years. Counts toward American studies major, women's studies major and concentration, and family studies concentration.","['HWC', 'MCD']",NA,"",NA,"['Judy Kutulas']",200,"['HH 501']","Women in America","",272,"False","False","",3,"C",20113,"['MWF 1045-1140']","","Research",2011,32
"776",80813,1,979,"['PHIL']","This course examines the main Western ethical theories and their application to contemporary moral concerns. Theoretical issues may include rights, duties, virtue, hedonism, egoism, the relation between ethics and theology, the fact-value distinction, relativism, and pluralism. Students discuss current topics such as global economic justice, euthanasia, the death penalty, animal rights, censorship, racism, privacy rights versus public safety, reproductive ethics, and environmental ethics. Prerequisite: completion of BTS-T or permission of instructor. Offered annually. Counts toward biomedical studies concentration.","['EIN']",NA,"",NA,"['Gordon D. Marino']",200,"['BMC 101']","Ethics/The Good Life","Prerequisite: Completion of BTS-T or permission of instructor. Open only to seniors during web registration.",252,"False","Prerequisite: completion of BTS-T or permission of instructor. Offered annually. Counts toward biomedical studies concentration.","A",3,"C",20113,"['MWF 1045-1140']","Ethics and the Good Life","Research",2011,32
"779",80816,1,978,"['ASIAN', 'PHIL']","This course surveys the influential philosophical traditions of India and China. Students explore the major traditions including Hinduism, Buddhism, Jainism, Confucianism and Taoism and consider other traditions with which they have interacted. Where appropriate, comparisons are drawn to Western philosophical traditions. Offered most years.","['MCG']",NA,"",NA,"['Anantanand Rambachan']",200,"['BMC 101', 'BMC 101']","Asian Philosophy","",251,"False","False","",3,"C",20113,"['T 0935-1100', 'Th 0930-1050']","","Research",2011,26
"788",80828,1,1181,"['PSYCH']","This course examines several major theoretical perspectives on psychotherapy. Students review empirically supported treatments for specific clinical disorders, as well as ""nonspecific"" factors that affect the therapeutic process. Students explore ethical and legal challenges related to psychotherapy delivery, as well as multicultural and other diversity issues. Course format is primarily discussion-based. This course is open only to juniors and seniors. Prerequisites: Psychology 230, and 244 or 247. Offered most years. Counts toward biomedical studies concentration.","",NA,"",NA,"['Molly M. Kodl']",300,"['RNS 124']","Clinical/Counseling Psych","",375,"False","Prerequisites: Psychology 230, and 244 or 247. Offered most years. Counts toward biomedical studies concentration.","A",3,"C",20113,"['M 0700-1000PM']","Clinical and Counseling Psychology","Research",2011,17
"790",80830,1,1346,"['SPAN']","Students explore one or more periods, genres, or topics from Pre-Columbian times to the 21st century. Selected literary works are analyzed within their socio-historical and cultural contexts and in reference to pertinent critical or theoretical issues. Sample topics include: The Shaping of Latin America; Personalism and Politics; Love and Magical Realism; and Literary Representations of Kitchens, Cooking, and Eating in Latin America. Students may register more than once provided a different topic is offered. Taught in Spanish. Prerequisite: Spanish 275.","['ALS-L']",NA,"",NA,"['Leon Narvaez']",300,"['TOH 314', 'TOH 314']","Top: Love/Mag Realism","",314,"False","Prerequisite: Spanish 275.","",3,"C",20113,"['T 0120-0245PM', 'Th 0215-0335PM']","Literature and Society in Latin America","Topic",2011,18
"800",80851,1,620,"['HIST']","Spanning at least twelve thousand years and involving more than five hundred indigenous nations the history of Native America is complex and diverse. This course focuses on significant themes, time periods, or geographical regions, with emphasis on the Native peoples within the modern-day continental United States. Examples include ""The Trail of Tears,"" ""The West Before Lewis and Clark,"" and ""Pontiac's America."" Offered periodically. Counts towards American studies and ARMS majors and ARMS concentration.","['MCD']",NA,"",NA,"['Steven C. Hahn']",200,"['HH 317']","Top: West/Lewis & Clark","",282,"False","False","",3,"C",20113,"['MWF 1150-1245PM']","Topics in Native American History","Topic",2011,31
"806",80857,1,21531,"['ASIAN', 'REL']","The Indian Church, which claims the apostle Thomas as its founder, is the ""home base"" for this historical exploration of Christianity from the apostolic age to the present. The course considers Christian teachings about God and Jesus, biblical interpretation, worship, response to social, political,, and cultural practices through encounters between Indian Christians and other churches. The multiple religions of India, its colonial experience, and its contemporary society are essential context. Prerequisite: BTS-B.","['BTS-T']",NA,"",NA,"['L. DeAne Lagerquist']",200,"['BMC 111']","Jesus on the Indian Road","",254,"False","Prerequisite: BTS-B.","",3,"C",20113,"['MWF 0905-1000']","Jesus on the Indian Road: A Perspective on Christianity","Research",2011,30
"810",80880,1,24266,"['HIST']","This course examines the environmental history of Latin America from ancient times to the present. Through readings and discussion, students explore topics such as pre-conquest indigenous agriculture, the environmental consequences of European colonization, Latin American understandings of nature, the Green Revolution, deforestation, questions of international environmental justice, and the growing links between the region's indigenous peoples and international environmental organizations. Offered annually. Counts toward environmental studies major (all tracks) and concentration, hispanic studies major and concentration, and Latin American/Latino studies concentration.","['MCG', 'ORC']",NA,"",NA,"['Jeane DeLaney']",200,"['HH 514', 'HH 514']","Env History/Latin America","",245,"False","False","",3,"C",20113,"['T 0120-0245PM', 'Th 0215-0335PM']","Environmental History of Latin America","Research",2011,18
"818",80981,1,24283,"['PSCI']","This class aims to better understand the racial climate in the United States, and the implications for American politics. Differing analytical perspectives from political science are used to interpret the role of race. A central question is the degree to which ""post-racial"" is an appropriate description of the current era. Offered annually. Counts toward political science major.","['HBS', 'MCD']",NA,"",NA,"['Adriano Udani']",200,"['TOH 108']","Race and Politics","",244,"False","False","",3,"C",20113,"['MWF 1255-0150PM']","Race and American Politics","Research",2011,24
"821",80988,1,1289,"['SOAN']","This course helps students explore the connections between society and their own lives. Students answer challenging questions such as ""Do we have a 'human nature'?,"" ""Why does social inequality exist?,"" ""What is race?,"" and ""How do societies change?"" In answering these questions students learn to develop a sociological imagination. In doing so they review the various research methods and theories that form the sociological tradition. This course is open to first-year students or students in certain accredited programs. Open to all students when taught during the summer. Offered each semester. Counts towards American studies major.","['HBS', 'MCD']",NA,"",NA,"['Ryan R. Sheppard']",100,"['HH 302', 'HH 302']","Intro to Sociology","Open to first-year students only.",121,"False","False","C",3,"C",20113,"['T 0935-1100', 'Th 0930-1050']","Introduction to Sociology","Research",2011,22
"830",81024,1,1289,"['SOAN']","This course helps students explore the connections between society and their own lives. Students answer challenging questions such as ""Do we have a 'human nature'?,"" ""Why does social inequality exist?,"" ""What is race?,"" and ""How do societies change?"" In answering these questions students learn to develop a sociological imagination. In doing so they review the various research methods and theories that form the sociological tradition. This course is open to first-year students or students in certain accredited programs. Open to all students when taught during the summer. Offered each semester. Counts towards American studies major.","['HBS', 'MCD']",NA,"",NA,"['Ryan R. Sheppard']",100,"['HH 302', 'HH 302']","Intro to Sociology","Open to first-year students only.",121,"False","False","D",3,"C",20113,"['T 1145-0110PM', 'Th 1245-0205PM']","Introduction to Sociology","Research",2011,22
"831",81025,1,1306,"['SOAN']","Students explore the continuing significance of color, class, and immigration in the U.S., with a focus on the experiences and concerns of African-Americans, Native Americans, Hispanics/Latinos, and Asian-Americans. The course examines the nature and functions of prejudice; the relationship among race, class and gender; the persistence of racism and inequality; and social policies and social movements intended to create greater social justice. Offered annually in the fall or spring semester. Counts towards American studies, ARMS and Hispanic studies majors and ARMS, Africa & the Americas and Hispanic studies concentrations.","['HBS', 'MCD']",NA,"",NA,"['Bruce Nordstrom-Loeb']",200,"['HH 403']","Race/Class-Am Culture","",264,"False","False","",3,"C",20113,"['MWF 0200-0255PM']","Race and Class in American Culture","Research",2011,35
"852",82235,1,63,"['ART']","This course serves as an introductory survey of the diverse arts and cultures of sub-Saharan Africa. Students investigate material culture in its original context to understand the social roles that art plays in many aspects of life. Students also learn to identify and discuss styles, materials, techniques, and the roles of artists. Special topics considered may include: contemporary versus historical art in Africa, notions of ""authenticity"" and tourist art, cultural heritage and repatriation of art works, and the politics and history of museum display. Offered periodically. Counts towards Africa & the Americas concentration.","['ALS-A', 'MCG', 'WRI']",NA,"",NA,"['Christopher Tradowsky']",200,"['DC 204']","African Art History","",269,"False","False","",3,"C",20113,"['MWF 0200-0255PM']","","Research",2011,19
"870",85328,1,25202,"['ENGL']","This course examines the life cycle of black women in Africa, Canada, the Caribbean, and the United States. Romance, marriage, family, interracial relations, mothers and daughters, urban environments, gender politics and sexual violence, relations among females, intergenerational depictions, historical experiences, public expression and private reflections, individual and communal identities, class considerations--all of these and more images and themes arise in the selection of fictional readings required for this course. Students read such writers as Mariama Ba, Gordimer, Hurston, and Naylor. Ticket/transportation fee required. Prerequisite: FYW or equivalent. Offered occasionally in Interim.","['ALS-L', 'MCG']",NA,"",NA,"['Joan Hepburn']",200,"['RML 515', 'RML 515']","Women of African Diaspora","",207,"False","Prerequisite: FYW or equivalent. Offered occasionally in Interim.","A",3,"C",20113,"['T 0120-0245PM', 'Th 0215-0335PM']","Women of the African Diaspora","Research",2011,26
"871",85329,1,25188,"['ENGL']","After the Second World War, Britain experienced a surge in immigration from the Caribbean, South Asia, and Africa, a crucial step in the transformation of Britain into a multiracial, multicultural nation. Over the past several decades, these immigrants and their descendants have crafted distinct bodies of work in literature, film, music, and visual art. This course is a broad, multi-genre introduction to this work with particular emphasis on its historical and cultural context. Prerequisite: FYW or equivalent. Offered in alternate years.","['ALS-L', 'MCG']",NA,"",NA,"['Jonathan T. Naito']",200,"['RML 421']","Black & Asian Brit Lit","",208,"False","Prerequisite: FYW or equivalent. Offered in alternate years.","",3,"C",20113,"['MWF 1045-1140']","Black and Asian British Literatures","Research",2011,28
"876",85334,1,25201,"['SOAN']","How does social class stratification shape individuals' life chances in the U.S.? This course introduces students to classical and contemporary theories of social class; seminal empirical studies that investigate the power of social class in shaping both individuals and the nature of the society in which they live; the relationship between class, race, and gender; poverty and public policy; and class consciousness and class conflict. Prerequisite: Sociology/Anthropology 121 or another 100-or 200-level sociology/anthropology course. Offered annually.","['HBS']",NA,"",NA,"['Theodore E. Thornhill']",200,"['RNS 208']","Class, Status, and Power","",268,"False","Prerequisite: Sociology/Anthropology 121 or another 100-or 200-level sociology/anthropology course. Offered annually.","",3,"C",20113,"['MWF 1150-1245PM']","","Research",2011,25
"906",85468,1,642,"['HIST']","","",NA,"",NA,"['Robert Entenmann']",300,"","IR/SE Asia/Cold War","",398,"False","False","A",3,"O",20113,"","Independent Research","Research",2011,1
"914",85502,1,25202,"['ENGL']","This course examines the life cycle of black women in Africa, Canada, the Caribbean, and the United States. Romance, marriage, family, interracial relations, mothers and daughters, urban environments, gender politics and sexual violence, relations among females, intergenerational depictions, historical experiences, public expression and private reflections, individual and communal identities, class considerations--all of these and more images and themes arise in the selection of fictional readings required for this course. Students read such writers as Mariama Ba, Gordimer, Hurston, and Naylor. Ticket/transportation fee required. Prerequisite: FYW or equivalent. Offered occasionally in Interim.","['ALS-L', 'MCG']",NA,"R",NA,"['Joan Hepburn']",200,"['RML 420', 'RML 420']","Women of African Diaspora","",207,"False","Prerequisite: FYW or equivalent. Offered occasionally in Interim.","B",3,"C",20113,"['T 1145-0110PM', 'Th 1245-0205PM']","Women of the African Diaspora","Research",2011,25
"917",85525,1,1320,"['SOAN']","","",NA,"",NA,"['Bruce Nordstrom-Loeb']",300,"","IR/Global Race and Gender","",398,"False","False","A",3,"O",20113,"","Independent Research","Research",2011,1
"925",85535,1,1181,"['PSYCH']","This course examines several major theoretical perspectives on psychotherapy. Students review empirically supported treatments for specific clinical disorders, as well as ""nonspecific"" factors that affect the therapeutic process. Students explore ethical and legal challenges related to psychotherapy delivery, as well as multicultural and other diversity issues. Course format is primarily discussion-based. This course is open only to juniors and seniors. Prerequisites: Psychology 230, and 244 or 247. Offered most years. Counts toward biomedical studies concentration.","",NA,"",NA,"['Christine A. Gibbon']",300,"['RNS 131']","Clinical/Counseling Psych","",375,"False","Prerequisites: Psychology 230, and 244 or 247. Offered most years. Counts toward biomedical studies concentration.","B",3,"C",20113,"['M 0700-1000PM']","Clinical and Counseling Psychology","Research",2011,19
"937",85573,1,493,"['FREN']","Students study a particular genre or medium (e.g., novel, play, poetry, short story, film) from a variety of periods and authors, with particular emphasis on form. Coursework includes close reading, discussion, in-depth analysis and interpretation of works. Sample topics: ""The Short Story,"" ""Autobiography,"" and ""The African Novel."" May be repeated if genre is different. Taught in French. Prerequisite: minimum of one 270-level course. Counts towards medieval studies major.","",NA,"",NA,"['Amine R. Bekhechi']",300,"['TOH 108', 'TOH 108']","Genre: N African Novel","",373,"False","Prerequisite: minimum of one 270-level course. Counts towards medieval studies major.","",3,"O",20113,"['T 0935-1100', 'Th 0930-1050']","Genre Studies","Research",2011,17
"1051",86360,1,1141,"['PSCI']","After completion of three courses in political science, students may approach a member of the department faculty and propose a course of study not currently offered to be conducted in tutorial fashion.","",NA,"",NA,"['Daniel Hofrenning']",200,"","IS/Race Religion Politics","",298,"False","False","B",3,"C",20113,"","Independent Study","Research",2011,1
