"","clbid","credits","crsid","departments","description","gereqs","groupid","grouptype","halfcredit","instructors","level","locations","name","notes","number","pn","prerequisites","section","semester","status","term","times","title","type","year","enrolled"
"110",78937,1,617,"['HIST']","By examining the interaction of people and environment on the North American continent from the 15th century to the present, this course shows how history ""takes place"" in ecological contexts that change over time. Students compare Native American and Euro-American religious beliefs, social values, economic aspirations, and technological developments and examine their consequences for the flora, fauna, and peoples of the continent. Offered most years. Counts towards American studies major and environmental studies major (all tracks) and concentration.","['HWC']",NA,"",NA,"['James Farrell']",200,"['HH 403']","Am. Environmental History","",275,"False","False","",3,"C",20113,"['MWF 0905-1000']","Environmental History","Research",2011,37
"112",78940,1,1103,"['PSCI']","The promise of American politics is the equal freedom of all. How does practice match principles? What roles do class and race play? Do interest groups and political parties foster democracy? This course is designed not only to help students understand American government and politics but also to motivate them to be active and informed participants. Offered annually. Counts towards American studies major.","['HBS', 'MCD']",NA,"",NA,"['Joshua Anderson']",100,"['HH 307']","American Politics","This course has class year limits.",111,"False","False","",3,"C",20113,"['MWF 1255-0150PM']","","Research",2011,32
"126",78958,1,18781,"['ASIAN']","Having looked at how people journey through Asia, this final semester in Asian Conversations considers how ideas travel over time and space. Students examine a range of interpretations of Asia, including the spiritual, literary, philosophical and linguistics. Students are required to publicly present the ideas gathered from contacts made during Interim at the beginning of the semester. Additional materials include memoirs, novels, and films that share individualized interpretations of Asian journeys. Prerequisite: Chinese 231 or Japanese 231 and Asian Studies 215 or 216. Offered annually in the spring semester.","['ALS-A', 'ALS-L', 'HBS', 'MCG', 'ORC', 'WRI']",NA,"",NA,"['Robert Entenmann']",200,"['HH 317', 'HH 317']","AsiaCon3:InterpretJourney","Registration restricted to students in the Asian Con program.",220,"False","Prerequisite: Chinese 231 or Japanese 231 and Asian Studies 215 or 216. Offered annually in the spring semester.","",3,"C",20113,"['T 1145-0110PM', 'Th 1245-0205PM']","Asian Conversations III: Interpreting Journeys","Research",2011,30
"229",79122,1,371,"['DANCE']","Students trace and integrate the African-American and Euro-American dance traditions of the late 19th, 20th and early 21st centuries, paying attention to their similarities and differences. The focus is on the theatrical dance genres of ballet, modern, and jazz (includes social dance, tap, and some musical theatre dance). At the same time, the course attends to the economic, religious, political, and social forces that have affected the development of dance in the United States. Prerequisite: Dance 100 Introduction to Dance or permission of instructor. Ticket/transportation fee required. Offered annually in the spring semester. Counts towards ARMS and American studies majors and ARMS concentration.","['ALS-A', 'MCD', 'WRI']",NA,"",NA,"['Heather J. Klopchin']",200,"['DC 204']","Dance in United States","Prerequisite: Completion of Dance 100.",246,"False","Prerequisite: Dance 100 Introduction to Dance or permission of instructor. Ticket/transportation fee required. Offered annually in the spring semester. Counts towards ARMS and American studies majors and ARMS concentration.","",3,"O",20113,"['MWF 1255-0150PM']","Dance in the United States","Research",2011,8
"230",79123,1,177,"['AMCON']","In this century of institutional development, national expansion, and sectional conflict, Americans continued to define a national identity. Students probe the ways in which region, religion, race, ethnicity, and gender inform individual and group contributions to the conversation. They also analyze how geographical expansion and ideas of progress influenced different visions and versions of America. Topics and texts range from Transcendentalist writers, the Second Great Awakening, and Black Elk Speaks to landscape painting and Western photography. Prerequisite: American Conversations 101. Offered annually in the spring semester. Counts towards American studies major.","['FYW', 'HWC']",NA,"",NA,"['Eric J. Fure-Slocum', 'Megan J. Feeney']",100,"['BMC 101']","Dem Vistas: 1800-1900","Open to American Conversations students only.",102,"False","Prerequisite: American Conversations 101. Offered annually in the spring semester. Counts towards American studies major.","A",3,"C",20113,"['MWF 0200-0255PM']","Democratic Vistas, 1800-1900","Research",2011,20
"231",79124,1,177,"['AMCON']","In this century of institutional development, national expansion, and sectional conflict, Americans continued to define a national identity. Students probe the ways in which region, religion, race, ethnicity, and gender inform individual and group contributions to the conversation. They also analyze how geographical expansion and ideas of progress influenced different visions and versions of America. Topics and texts range from Transcendentalist writers, the Second Great Awakening, and Black Elk Speaks to landscape painting and Western photography. Prerequisite: American Conversations 101. Offered annually in the spring semester. Counts towards American studies major.","['FYW', 'HWC']",NA,"",NA,"['Eric J. Fure-Slocum', 'Megan J. Feeney']",100,"['BMC 110']","Dem Vistas: 1800-1900","Open to American Conversations students only.",102,"False","Prerequisite: American Conversations 101. Offered annually in the spring semester. Counts towards American studies major.","B",3,"C",20113,"['MWF 0200-0255PM']","Democratic Vistas, 1800-1900","Research",2011,19
"261",79171,1,979,"['PHIL']","This course examines the main Western ethical theories and their application to contemporary moral concerns. Theoretical issues may include rights, duties, virtue, hedonism, egoism, the relation between ethics and theology, the fact-value distinction, relativism, and pluralism. Students discuss current topics such as global economic justice, euthanasia, the death penalty, animal rights, censorship, racism, privacy rights versus public safety, reproductive ethics, and environmental ethics. Prerequisite: completion of BTS-T or permission of instructor. Offered annually. Counts toward biomedical studies concentration.","['EIN']",NA,"",NA,"['Gordon D. Marino']",200,"['RNS 390']","Ethics/The Good Life","Prerequisite: Completion of BTS-T or permission of instructor. Open only to seniors during web registration.",252,"False","Prerequisite: completion of BTS-T or permission of instructor. Offered annually. Counts toward biomedical studies concentration.","B",3,"C",20113,"['MWF 1255-0150PM']","Ethics and the Good Life","Research",2011,39
"264",79176,1,574,"['HIST']","This course surveys European history and culture since the Reformation. Topics include the impact of Protestantism, the development of nation-states, the Enlightenment, revolutionary ideas and experiences, the Napoleonic era, imperialism, mass political movements, and global warfare. Through original texts, historical studies, and literature, students explore relations among religions, states and societies and understandings of liberty and reason, natural environments, family life, and gender roles. Offered most years.","['HWC']",NA,"",NA,"['Anna Kuxhausen']",100,"['HH 403']","Eur/Reform/Modern","",191,"False","False","",3,"C",20113,"['MWF 1150-1245PM']","Europe from the Reformation to Modern Times","Research",2011,37
"299",79219,1,486,"['FREN']","Students explore French-speaking regions of the world outside France through the close reading, discussion, and analysis of literary and non-literary texts as well as other cultural artifacts. Readings, discussions, viewings, and written and oral assignments are organized around the exploration of specific topics or themes. May be repeated if geographical region is different. Taught in French. Prerequisite: minimum of one 250-level course (two recommended). Counts towards Africa & the Americas concentration.","",NA,"",NA,"['Jean E. Biem']",200,"['TOH 310', 'TOH 310']","Fr World: The Caribbean","",271,"False","Prerequisite: minimum of one 250-level course (two recommended). Counts towards Africa & the Americas concentration.","",3,"O",20113,"['T 0120-0245PM', 'Th 0215-0335PM']","The Francophone World","Research",2011,12
"305",79244,1,576,"['HIST']","This course takes a comparative and chronological approach to studying the diverse cultures of the modern world. Through original texts, historical studies, and literary sources, students examine such themes as the rise of American imperialism and its impact on indigenous peoples of the Americas, Asia, and Africa; the emergence of the nation-state and new ideologies; the spread of American influence in the world; human interaction with the environment; challenges to religion and traditional life-styles; and innovation in family and gender structures. Offered most years.","['MCG']",NA,"",NA,"['Abdulai Iddrisu']",100,"['BMC 111']","Global 1500-Present","",195,"False","False","",3,"C",20113,"['MWF 1045-1140']","Global Histories from 1500 to the Present","Research",2011,40
"307",79263,1,1336,"['SPAN']","Students examine the diverse elements that have shaped Latin American culture through an exploration of political, social, economic, religious, and artistic topics. They develop critical analysis skills through reading, discussion, and written and/or oral projects. The course features the study of selected literary and non-literary texts, including at least one substantive literary work. Taught in Spanish. Prerequisite: Spanish 250.","",NA,"",NA,"['Ariel Strichartz']",200,"['TOH 212']","Heritage Latin America","",272,"False","Prerequisite: Spanish 250.","",3,"C",20113,"['MWF 1150-1245PM']","Cultural Heritage of Latin America","Research",2011,17
"362",79341,1,1326,"['SPAN']","Through exploring the geographic and human diversity of the Spanish-speaking world, students develop increasingly complex skills for analyzing and communicating in Spanish. They study such essential dimensions of that world as: (1) geography and development; (2) environmental challenges and solutions; (3) population and demographic changes and challenges; and (4) ethnic diversity. Prerequisite: Spanish 112 or placement. Offered each semester and during Interim.","",NA,"",NA,"[""Jonathan P. O'Conner""]",200,"['TOH 314']","Intermed Spanish I","",231,"False","Prerequisite: Spanish 112 or placement. Offered each semester and during Interim.","B",3,"C",20113,"['MWF 1045-1140']","Intermediate Spanish I","Research",2011,18
"363",79342,1,1326,"['SPAN']","Through exploring the geographic and human diversity of the Spanish-speaking world, students develop increasingly complex skills for analyzing and communicating in Spanish. They study such essential dimensions of that world as: (1) geography and development; (2) environmental challenges and solutions; (3) population and demographic changes and challenges; and (4) ethnic diversity. Prerequisite: Spanish 112 or placement. Offered each semester and during Interim.","",NA,"",NA,"['Jessica A. Haugsland']",200,"['TOH 314']","Intermed Spanish I","",231,"False","Prerequisite: Spanish 112 or placement. Offered each semester and during Interim.","C",3,"C",20113,"['MWF 1255-0150PM']","Intermediate Spanish I","Research",2011,20
"364",79344,1,1326,"['SPAN']","Through exploring the geographic and human diversity of the Spanish-speaking world, students develop increasingly complex skills for analyzing and communicating in Spanish. They study such essential dimensions of that world as: (1) geography and development; (2) environmental challenges and solutions; (3) population and demographic changes and challenges; and (4) ethnic diversity. Prerequisite: Spanish 112 or placement. Offered each semester and during Interim.","",NA,"",NA,"[""Jonathan P. O'Conner""]",200,"['TOH 314']","Intermed Spanish I","",231,"False","Prerequisite: Spanish 112 or placement. Offered each semester and during Interim.","A",3,"C",20113,"['MWF 0905-1000']","Intermediate Spanish I","Research",2011,21
"384",79370,1,1289,"['SOAN']","This course helps students explore the connections between society and their own lives. Students answer challenging questions such as ""Do we have a 'human nature'?,"" ""Why does social inequality exist?,"" ""What is race?,"" and ""How do societies change?"" In answering these questions students learn to develop a sociological imagination. In doing so they review the various research methods and theories that form the sociological tradition. This course is open to first-year students or students in certain accredited programs. Open to all students when taught during the summer. Offered each semester. Counts towards American studies major.","['HBS', 'MCD']",NA,"",NA,"['Theodore E. Thornhill']",100,"['TOH 310']","Intro to Sociology","Open to first-year students only.",121,"False","False","A",3,"C",20113,"['MWF 0800-0855']","Introduction to Sociology","Research",2011,18
"387",79377,1,32,"['ART']","This introduction to art history examines select European, Native American, Euro-American, and African artistic traditions from c. 1400 to the present. Through lectures, discussions, and other activities, students develop skills in visual analysis and interpretation. The course considers a variety of artistic media, including painting, sculpture, architecture, and textiles, as well as broader issues of aesthetics, function, and patronage. Offered annually.","['ALS-A', 'HWC', 'ORC']",32,"",NA,"['Christopher Tradowsky']",100,"['DC 305']","Intro/Art History II","",151,"False","False","",3,"C",20113,"['MW 1045-1140']","Introduction to Art History II","Research",2011,47
"421",79413,1,1480,"['WMNST']","","",NA,"",NA,"['Abdulai Iddrisu']",300,"","IR/Women Nt'l Mvmt Africa","",398,"False","False","",3,"O",20113,"","Independent Research","Research",2011,0
"488",79513,1,1302,"['SOAN']","This course explores the forces that shape contemporary Latin American society, including material and cultural interactions with Europe, Africa, and the U.S. Emphasis is placed on understanding the formation of the region in terms of the responses of key groups of actors (indigenous peoples, women, peasants, workers, the poor, migrants, revolutionaries) to the actions of outside and/or more powerful forces and institutions (foreign invaders, the state, the military, missionaries, multinational corporations). Offered annually in the fall or spring semester. Counts toward Hispanic studies major and concentration.","['HBS', 'MCG']",NA,"",NA,"['Christopher L. Chiappari']",200,"['HH 317', 'HH 317']","Latin Am Culture","",237,"False","False","",3,"C",20113,"['T 0120-0245PM', 'Th 0215-0335PM']","Forging a Latin American Culture","Research",2011,25
"540",79585,1,22440,"['HIST']","This seminar introduces students to the nature and development of Muslim societies in sub- Saharan Africa, from the earliest times to the present. Students also explore questions of authenticity and ""historical truth"" as they examine current debates on themes such as patterns of Islamization, ""African Islam,"" and Islam in Africa. Other themes include the invention of Muslim identities, expansion of Sufism, women in Islam, Islamic education, Islam and colonialism as well as revivalism in Islam. Offered annually.","['MCG']",NA,"",NA,"['Abdulai Iddrisu']",200,"['HH 413', 'HH 413']","Muslim Societies/Sub-Saha","",292,"False","False","",3,"C",20113,"['T 1145-0110PM', 'Th 1245-0205PM']","Muslim Societies in Sub-Saharan Africa","Research",2011,38
"606",79708,1,16,"['AFAM']","Based upon courses from participating departments, the seminar introduces students to the historical and cross-cultural experiences of Africans and African Americans. It affords students the chance to engage in interdisciplinary interpretation and analysis and encourages them to interpret their own heritage in light of the African/African American experience. This course emphasizes literary texts. Counts toward ARMS and American Studies majors and American studies concentration.","['ALS-L', 'MCG']",NA,"",NA,"['Abdulai Iddrisu']",200,"['RML 421', 'RML 421']","Sem: Africa/Americas","",231,"False","False","",3,"C",20113,"['T 0935-1100', 'Th 0930-1050']","Africa and the Americas: The Diaspora Experience","Seminar",2011,30
"618",79726,1,1481,"['WMNST']","The course provides a capstone to the major. Taught as a seminar, it offers an opportunity for students to integrate their studies of women across disciplines and to become more aware of the intricate web of gender, race, culture, and class that informs women's experiences. Prerequisite: Women's Studies 121. Offered annually in the spring semester.","['WRI']",NA,"",NA,"['Diane C. LeBlanc']",300,"['RML 420']","Sem:3rd Wave Theory/Actio","Open to Junior and Senior Women's Studies majors only, except by permission of instructor.",399,"False","Prerequisite: Women's Studies 121. Offered annually in the spring semester.","",3,"O",20113,"['MWF 1150-1245PM']","Advanced Topics in Women's Studies","Seminar",2011,12
"626",79738,1,1363,"['SWRK']","Immigration policy and welfare reform exemplify how society's values and needs translate into policies and programs. Social workers work for justice by creating, implementing, and evaluating policies in health, employment, housing, and child welfare. Students study policy formation and analysis that reflect interests and powers of diverse groups as well as economic and social needs of certain populations at risk. The course emphasizes policy impact on women, people in poverty, African-Americans, gay men and lesbians, and Latinos. Open to non-majors by permission of instructor. Offered annually in the spring semester. Counts towards American studies major and biomedical studies concentration.","",NA,"",NA,"['Mary Carlsen']",200,"['TOH 214']","Social Policy","This course has class year limits. Not open to First-Year Students.",258,"False","False","",3,"C",20113,"['MWF 1150-1245PM']","","Research",2011,23
"632",79750,1,1340,"['SPAN']","Students explore the processes involved in the acquisition of Spanish as a first and second language and the variation present in the language of both native and non-native speakers of Spanish from Spain, Latin America, and the U.S. Hispanic linguistics are studied with special attention paid to the socio-cultural as well as structural aspects. The course includes the study of at least one substantive literary work. Includes pronunciation lab. Taught in Spanish. Prerequisite: Spanish 250. Offered each semester.","",NA,"",NA,"['Kris A. Cropsey']",200,"['TOH 314']","Spanish 1st/2nd Lang","",276,"False","Prerequisite: Spanish 250. Offered each semester.","",3,"C",20113,"['MWF 0200-0255PM']","Spanish as a First and Second Language","Research",2011,18
"655",79777,1,325,"['EDUC']","This course prepares pre-service communication arts/literature teachers to share their love of the English language with secondary students. Attention is given to the theory and techniques of teaching speech, listening, media literacy, writing, literature and reading. In addition, students explore topics including multicultural literature, adolescent literature, responding to and evaluating writing, unit planning in the language arts, and the National Council of Teachers of English Standards. Required field experience component. Prerequisite: Education 330. Offered annually in the spring semester.","",NA,"",NA,"['Elizabeth A. Leer']",300,"['TOH 214', 'TOH 214']","Tchg of Comm Arts/Lit","",345,"False","Prerequisite: Education 330. Offered annually in the spring semester.","",3,"O",20113,"['T 1145-0110PM', 'Th 1245-0205PM']","Teaching of Communication Arts/Literature, 5-12","Research",2011,4
"667",79805,1,22610,"['IS']","In this seminar, students will consider how immigrants work through their national, ethnic, or racial heritage to contribute to the creative and spiritual life of their new nation, and ways in which this collection of voices creates harmony and/or dissonance. We will read novels, short stories, and poems, and study private writings (letters and diaries), films, artworks, and other artifacts, in the context of the history of American immigration and of issues facing current immigrant groups.","['ALS-L', 'HWC', 'WRI']",NA,"",NA,"['Solveig Zempel']",200,"['TOH 312', 'TOH 312']","Top: Chron-Am Immig Exper","Not open to first-year students.",218,"False","False","",3,"C",20113,"['T 0935-1100', 'Th 0930-1050']","","Topic",2011,28
"701",80617,1,16962,"['ASIAN']","The Universal Declaration of Human Rights proclaims that ""the inherent dignity and ... the equal and inalienable rights of all members of the human family [are] the foundation of freedom, justice and peace in the world."" Who speaks to human rights in East Asia? What ethical perspectives are voiced? Case studies presented through memoirs, films, reports, and multidisciplinary analyses provide the material for exploring diverse normative claims about individual rights in East Asia. Prerequisites: Asian Studies 275 or permission of the instructor and completion of BTS-T. Offered annually.","['EIN', 'WRI']",NA,"",NA,"['J. Patrick Dale', 'Katherine S. Tegtmeyer Pak']",300,"['HH 403', 'HH 403']","Human Rights/AsianContext","Prerequisite: Completion of BTS-T or permission of instructor. Open only to seniors during web registration.",397,"False","Prerequisites: Asian Studies 275 or permission of the instructor and completion of BTS-T. Offered annually.","",3,"C",20113,"['T 0935-1100', 'Th 0930-1050']","Seminar: Human Rights/Asian Context","Research",2011,17
"702",80618,1,78,"['ASIAN']","This course examines major cultures of Asia from interdisciplinary and comparative perspectives with attention to theories of human behavior. Themes vary from year to year. No prerequisites.","['MCG']",NA,"",NA,"['Bruce Dalgaard']",100,"['TOH 212']","Asian Cultures","",121,"False","False","",3,"O",20113,"['MWF 0200-0255PM']","Asian Cultures in Comparative Perspectives","Research",2011,19
"708",80659,1,1289,"['SOAN']","This course helps students explore the connections between society and their own lives. Students answer challenging questions such as ""Do we have a 'human nature'?,"" ""Why does social inequality exist?,"" ""What is race?,"" and ""How do societies change?"" In answering these questions students learn to develop a sociological imagination. In doing so they review the various research methods and theories that form the sociological tradition. This course is open to first-year students or students in certain accredited programs. Open to all students when taught during the summer. Offered each semester. Counts towards American studies major.","['HBS', 'MCD']",NA,"",NA,"['Theodore E. Thornhill']",100,"['TOH 310']","Intro to Sociology","Open to first-year students only.",121,"False","False","B",3,"C",20113,"['MWF 0905-1000']","Introduction to Sociology","Research",2011,19
"726",80752,1,367,"['DANCE']","An introduction to world dance traditions, this course examines dance forms, functions, contexts, and differing aesthetics found in selected cultures of Africa, Asia, Europe, the Middle East, the South Pacific, and Latin America. The course includes lectures, discussion, video-viewing, and required field-trips to dance events, in addition to studio experiences where students learn dances from the cultures studied. No previous dance experience required. Ticket/transportation fee required. Offered in alternate years.","['ALS-A', 'MCG']",NA,"",NA,"['Anne von Bibra']",100,"['DC 305', 'DC 305']","World Dance Tradition","",124,"False","False","",3,"C",20113,"['T 0120-0245PM', 'Th 0215-0335PM']","World Dance Traditions","Research",2011,25
"763",80795,1,21544,"['HIST']","This seminar examines one of history's most dramatic episodes: the Spanish conquest and colonization of what is now Latin America. Through reading and discussion, students examine such topics as European and indigenous perceptions of the Conquest, the role of missionaries, the imperial enterprise, the response of native peoples to the imposition of Christianity, indigenous efforts to resist Spanish domination, the ecological/biological consequences of 1492, and subsequent debates over the morality of the conquest. Offered periodically.","['MCG', 'WRI']",NA,"",NA,"['Jeane DeLaney']",100,"['HH 515', 'HH 515']","Conquest and Colonization","Open to first-year students only.",126,"False","False","",3,"C",20113,"['T 0935-1100', 'Th 0930-1050']","","Research",2011,17
"764",80796,1,590,"['HIST']","How did Britain emerge as the world's first ""super-power""? Students examine British history from the Revolution of 1688 through the era of World War II. Topics include the aristocracy, the impact of the Industrial and French Revolutions, liberalism and capitalism, Victorian culture, the working class and political reform, the women's movement, the imperial achievement, the issue of Ireland, and the challenge of the world wars. Offered periodically.","['HWC']",NA,"",NA,"['Gary De Krey']",200,"['RML 577']","Modern Britain","",220,"False","False","",3,"C",20113,"['MWF 1045-1140']","","Research",2011,27
