"","clbid","credits","crsid","departments","description","gereqs","groupid","grouptype","halfcredit","instructors","level","locations","name","notes","number","pn","prerequisites","section","semester","status","term","times","title","type","year","enrolled"
"110",93875,1,577,"['HIST']","This course examines the development of American culture and society from the Columbian encounter through the Civil War. Topics include the interaction of Europeans, Africans, and indigenous peoples in early America; the social development of the British colonies; the evolution of American slavery; the Revolution and the Constitution; industrialization, expansion, and reform in the 19th century; and the Civil War. Offered most years. Counts towards American studies major.","['HWC', 'MCD']",NA,"",NA,"['Steven C. Hahn']",100,"['HH 403']","America to 1865","",198,"False","False","",1,"C",20141,"['MWF 0905-1000']","American History to 1865","Research",2014,35
"111",93876,1,1103,"['PSCI']","The promise of American politics is the equal freedom of all. How does practice match principles? What roles do class and race play? Do interest groups and political parties foster democracy? This course is designed not only to help students understand American government and politics but also to motivate them to be active and informed participants. Offered annually. Counts towards American studies major.","['HBS', 'MCD']",NA,"",NA,"['Joshua Anderson']",100,"['OM 030']","American Politics","This course has class year limits.",111,"False","False","A",1,"C",20141,"['MWF 1045-1140']","","Research",2014,31
"112",93877,1,1103,"['PSCI']","The promise of American politics is the equal freedom of all. How does practice match principles? What roles do class and race play? Do interest groups and political parties foster democracy? This course is designed not only to help students understand American government and politics but also to motivate them to be active and informed participants. Offered annually. Counts towards American studies major.","['HBS', 'MCD']",NA,"",NA,"['Joshua Anderson']",100,"['OM 030']","American Politics","This course has class year limits.",111,"False","False","B",1,"C",20141,"['MWF 1150-1245PM']","","Research",2014,31
"136",93908,1,18779,"['ASIAN']","How do pilgrims, travelers and migrants make sense of their journeys in Asia? Students explore maps, histories, tales, and guides that define Asia today and in years past, including several classic Asian texts; study how cultural, linguistic, economic, religious, social, and political connections and divisions create and sustain communities in Asia; and plan related projects for their Interim course. Prerequisite: CHIN 112 or JAPAN 112 or permission of instructor. Must be accepted into Asian Conversations program to register. Offered annually in the fall semester.","",NA,"",NA,"['Robert Entenmann', 'Hiroe Akimoto']",200,"['HH 403', 'HH 403']","AsianCon1:MappingJourneys","Registration for this course restricted to those students who have applied to the Asian Conversations program and been accepted into it.",210,"False","Prerequisite: CHIN 112 or JAPAN 112 or permission of instructor. Must be accepted into Asian Conversations program to register. Offered annually in the fall semester.","",1,"C",20141,"['T 1145-0110PM', 'Th 1245-0205PM']","Asian Conversations I: Mapping Journeys","Research",2014,37
"229",94048,1,1181,"['PSYCH']","This course examines several major theoretical perspectives on psychotherapy. Students review empirically supported treatments for specific clinical disorders, as well as ""nonspecific"" factors that affect the therapeutic process. Students explore ethical and legal challenges related to psychotherapy delivery, as well as multicultural and other diversity issues. Course format is primarily discussion-based. This course is open only to juniors and seniors. Prerequisites: PSYCH 230, plus PSYCH 244 or PSYCH 247. Offered annually.","",NA,"",NA,"['Molly M. Kodl']",300,"['RNS 124']","Clinical/Counseling Psych","",375,"False","Prerequisites: PSYCH 230, plus PSYCH 244 or PSYCH 247. Offered annually.","",1,"C",20141,"['M 0700-1000PM']","Clinical and Counseling Psychology","Research",2014,19
"242",94065,1,21544,"['HIST']","This seminar examines one of history's most dramatic episodes: the Spanish conquest and colonization of what is now Latin America. Through reading and discussion, students examine such topics as European and indigenous perceptions of the Conquest, the role of missionaries, the imperial enterprise, the response of native peoples to the imposition of Christianity, indigenous efforts to resist Spanish domination, the ecological/biological consequences of 1492, and subsequent debates over the morality of the conquest. Offered periodically. Counts toward Latin American studies major and concentration.","['MCG', 'WRI']",NA,"",NA,"['Jeane DeLaney']",100,"['HH 514', 'HH 514']","Conquest and Colonization","Open to first-year students only.",126,"False","False","",1,"C",20141,"['T 0120-0245PM', 'Th 0215-0335PM']","","Research",2014,16
"247",94074,1,1368,"['SWRK']","This course immediately precedes Social Work 380: Field Practicum. The course provides an overview of how structural oppression across cultural positions (e.g. race, sexuality, ability, class) may affect client systems. Students integrate awareness, knowledge, and skills for engaging in anti-oppressive, inclusive practice with individuals, families, groups, organizations, and communities. This includes role plays assisting clients who are challenged by oppression as part of their presenting problems and brief immersions with diverse communities. Prerequisite: SWRK 261. For senior majors only. Offered annually in September.","",NA,"",NA,"['Susan E. Smalling']",300,"['RNS 356A', 'RNS 356A', 'RNS 356A', 'RNS 356A']","Just Practice","Open to Senior Social Work majors only.",373,"False","Prerequisite: SWRK 261. For senior majors only. Offered annually in September.","",1,"O",20141,"['MWF 0800-1000', 'MWF 1150-0150PM', 'Th 0800-1050', 'Th 1130-0200PM']","","Research",2014,10
"249",94076,1,176,"['AMCON']","Spanning two centuries, from the founding of the colonies to the close of the Civil War, this course begins the discussion of questions central to the entire sequence: ""What is an American?"" ""What does it mean to be free?"" Students explore the institutions, images, and stories of Euro-Americans, African Americans, and Native Americans.Topics and texts range from the Declaration of Independence and Thomas Jefferson's architecture to the Narrative of the Life of Frederick Douglass and the coming of the Civil War. Offered annually in the fall semester. Counts towards American studies major.","",NA,"",NA,"['Colin Wells']",100,"['HH 403']","Declaring Ind: 1607-1865","Open to American Conversations students only.",101,"False","False","A",1,"C",20141,"['MWF 1255-0150PM']","Declaring Independence, 1607-1865","Research",2014,23
"250",94077,1,176,"['AMCON']","Spanning two centuries, from the founding of the colonies to the close of the Civil War, this course begins the discussion of questions central to the entire sequence: ""What is an American?"" ""What does it mean to be free?"" Students explore the institutions, images, and stories of Euro-Americans, African Americans, and Native Americans.Topics and texts range from the Declaration of Independence and Thomas Jefferson's architecture to the Narrative of the Life of Frederick Douglass and the coming of the Civil War. Offered annually in the fall semester. Counts towards American studies major.","",NA,"",NA,"['Eric J. Fure-Slocum']",100,"['HH 319']","Declaring Ind: 1607-1865","Open to American Conversations students only.",101,"False","False","B",1,"C",20141,"['MWF 1255-0150PM']","Declaring Independence, 1607-1865","Research",2014,19
"263",94095,1,268,"['ECON']","Students in this course learn and apply economic analysis, tempered by an appreciation for the political and institutional contexts of the less developed countries, to gain an understanding of these countries' economies. Using cases involving both written and oral analysis, students explore topics such as economic growth in Brazil, trade strategies in Singapore, poverty and income distribution in Taiwan, or macroeconomic performance in Mexico. Prerequisite: one of Economics 110-121 or permission of instructor. Offered annually. Counts toward environmental studies major (social science track) and Latin American major and concentration.","['MCG']",NA,"",NA,"['Seth Binder']",200,"['OM 030', 'OM 030']","Economic Development","",243,"False","Prerequisite: one of Economics 110-121 or permission of instructor. Offered annually. Counts toward environmental studies major (social science track) and Latin American major and concentration.","A",1,"C",20141,"['T 1145-0110PM', 'Th 1245-0205PM']","","Research",2014,19
"264",94096,1,268,"['ECON']","Students in this course learn and apply economic analysis, tempered by an appreciation for the political and institutional contexts of the less developed countries, to gain an understanding of these countries' economies. Using cases involving both written and oral analysis, students explore topics such as economic growth in Brazil, trade strategies in Singapore, poverty and income distribution in Taiwan, or macroeconomic performance in Mexico. Prerequisite: one of Economics 110-121 or permission of instructor. Offered annually. Counts toward environmental studies major (social science track) and Latin American major and concentration.","['MCG']",NA,"",NA,"['Seth Binder']",200,"['OM 030', 'OM 030']","Economic Development","",243,"False","Prerequisite: one of Economics 110-121 or permission of instructor. Offered annually. Counts toward environmental studies major (social science track) and Latin American major and concentration.","B",1,"C",20141,"['T 0120-0245PM', 'Th 0215-0335PM']","","Research",2014,23
"271",94109,1,24266,"['HIST']","This course examines the environmental history of Latin America from ancient times to the present. Through readings and discussion, students explore topics such as pre-conquest indigenous agriculture, the environmental consequences of European colonization, Latin American understandings of nature, the Green Revolution, deforestation, questions of international environmental justice, and the growing links between the region's indigenous peoples and international environmental organizations. Offered annually. Counts toward environmental studies major (all tracks) and concentration and Latin America studies major and concentration.","['MCG', 'ORC']",NA,"",NA,"['Jeane DeLaney']",200,"['BMC 012', 'BMC 012']","Env History/Latin America","",245,"False","False","",1,"C",20141,"['T 0935-1100', 'Th 0930-1050']","Environmental History of Latin America","Research",2014,19
"274",94112,1,979,"['PHIL']","This course examines the main Western ethical theories and their application to contemporary moral concerns. Theoretical issues may include rights, duties, virtue, hedonism, egoism, the relation between ethics and theology, the fact-value distinction, relativism, and pluralism. Students discuss current topics such as global economic justice, euthanasia, the death penalty, animal rights, censorship, racism, privacy rights versus public safety, reproductive ethics, and environmental ethics. Prerequisite: completion of BTS-T or permission of instructor. Offered annually. Counts toward biomedical studies concentration (for students through class of 2016).","['EIN']",NA,"",NA,"['Anthony J. Rudd']",200,"['OM 340']","Ethics/The Good Life","Prerequisite: Completion of BTS-T or permission of instructor. Open only to rising Seniors and Juniors during web registration.",252,"False","Prerequisite: completion of BTS-T or permission of instructor. Offered annually. Counts toward biomedical studies concentration (for students through class of 2016).","A",1,"C",20141,"['MWF 0905-1000']","Ethics and the Good Life","Research",2014,24
"275",94113,1,979,"['PHIL']","This course examines the main Western ethical theories and their application to contemporary moral concerns. Theoretical issues may include rights, duties, virtue, hedonism, egoism, the relation between ethics and theology, the fact-value distinction, relativism, and pluralism. Students discuss current topics such as global economic justice, euthanasia, the death penalty, animal rights, censorship, racism, privacy rights versus public safety, reproductive ethics, and environmental ethics. Prerequisite: completion of BTS-T or permission of instructor. Offered annually. Counts toward biomedical studies concentration (for students through class of 2016).","['EIN', 'WRI']",NA,"",NA,"['Anthony J. Rudd']",200,"['DC 204']","Ethics/The Good Life","Prerequisite: Completion of BTS-T or permission of instructor. Open only to rising Seniors and Juniors during web registration.",252,"False","Prerequisite: completion of BTS-T or permission of instructor. Offered annually. Counts toward biomedical studies concentration (for students through class of 2016).","C",1,"C",20141,"['MWF 0200-0255PM']","Ethics and the Good Life","Research",2014,17
"303",94152,1,1317,"['SOAN']","Students gain the skills necessary to conduct and critically evaluate quantitative research. Students learn the underlying theoretical assumptions and orientations of quantitative research, including research design, sampling techniques, strategies for data collection, and approaches to analysis. Students gain practice in data analysis by conducting a research project and using the Statistical Package for the Social Sciences (SPSS), a standard in sociology. Open to sociology/anthropology majors only. Prerequisite: STAT 110 or STAT 212. Offered annually in the fall semester. Counts toward environmental studies major (social science track).","['ORC', 'WRI']",NA,"",NA,"['Ryan R. Sheppard']",300,"['HH 302']","Found Soc Sci Resrch","Open to rising senior and junior Sociology/Anthropology majors only. Prerequisite: Statistics 110 or 212.",371,"False","Prerequisite: STAT 110 or STAT 212. Offered annually in the fall semester. Counts toward environmental studies major (social science track).","A",1,"O",20141,"['MWF 0905-1000']","Foundations of Social Science Research: Quantitative Methods","Research",2014,13
"304",94153,1,1317,"['SOAN']","Students gain the skills necessary to conduct and critically evaluate quantitative research. Students learn the underlying theoretical assumptions and orientations of quantitative research, including research design, sampling techniques, strategies for data collection, and approaches to analysis. Students gain practice in data analysis by conducting a research project and using the Statistical Package for the Social Sciences (SPSS), a standard in sociology. Open to sociology/anthropology majors only. Prerequisite: STAT 110 or STAT 212. Offered annually in the fall semester. Counts toward environmental studies major (social science track).","['ORC', 'WRI']",NA,"",NA,"['Ryan R. Sheppard']",300,"['HH 302']","Found Soc Sci Resrch","Open to rising senior and junior Sociology/Anthropology majors only. Prerequisite: Statistics 110 or 212.",371,"False","Prerequisite: STAT 110 or STAT 212. Offered annually in the fall semester. Counts toward environmental studies major (social science track).","B",1,"C",20141,"['MWF 1150-1245PM']","Foundations of Social Science Research: Quantitative Methods","Research",2014,17
"317",94176,1,1311,"['SOAN']","This course compares gender patterns and issues in various cultures around the world, such as Latin America, the Middle East, India, the U.S., and East Asia. How do cultural expectations for women and men vary? Why do some societies have more gender equality than others? How do economic and political change, including globalization, impact gender roles? How do U.S. and Third World feminism compare? Offered annually in the fall or spring semester. Counts towards race and ethnic studies major and concentration and Africa and the Americas and women's and gender studies concentrations.","['HBS', 'MCG']",NA,"",NA,"['Bruce Nordstrom-Loeb']",200,"['HH 403']","Gender/C-Cult/Persp","",261,"False","False","A",1,"C",20141,"['MWF 1150-1245PM']","Gender in Cross-Cultural Perspective","Research",2014,36
"318",94177,1,1311,"['SOAN']","This course compares gender patterns and issues in various cultures around the world, such as Latin America, the Middle East, India, the U.S., and East Asia. How do cultural expectations for women and men vary? Why do some societies have more gender equality than others? How do economic and political change, including globalization, impact gender roles? How do U.S. and Third World feminism compare? Offered annually in the fall or spring semester. Counts towards race and ethnic studies major and concentration and Africa and the Americas and women's and gender studies concentrations.","['HBS', 'MCG']",NA,"",NA,"['Bruce Nordstrom-Loeb']",200,"['HH 403']","Gender/C-Cult/Persp","",261,"False","False","B",1,"C",20141,"['MWF 0200-0255PM']","Gender in Cross-Cultural Perspective","Research",2014,28
"324",94192,1,456,"['ENVST', 'PSCI']","Population growth, industrialization, and the consumption of fossil fuels have increased global environmental problems. The course examines the ways in which nation-states and/or international institutions have addressed these environmental concerns. Depending on the instructor, the focus of the course is either the environmental problems of a particular area (e.g., Latin America, Russia or Asia) or a broader global arena (e.g., international institutions and the environment). Offered alternate years.","['HBS']",NA,"",NA,"['Anthony Pahnke']",200,"['RNS 208', 'RNS 208']","Global Env Politics","",201,"False","False","",1,"C",20141,"['T 0120-0245PM', 'Th 0215-0335PM']","Topics in Global Environmental Politics","Research",2014,26
"361",94243,1,16962,"['ASIAN']","The Universal Declaration of Human Rights proclaims that ""the inherent dignity and ... the equal and inalienable rights of all members of the human family [are] the foundation of freedom, justice and peace in the world."" Who speaks to human rights in East Asia? What ethical perspectives are voiced? Case studies presented through memoirs, films, reports, and multidisciplinary analyses provide the material for exploring diverse normative claims about individual rights in East Asia. Prerequisites: ASIAN 275 or permission of the instructor and completion of BTS-T. Offered annually.","['EIN', 'WRI']",NA,"",NA,"['Katherine S. Tegtmeyer Pak']",300,"['HH 515', 'HH 515']","Human Rights/AsianContext","Prerequisite: Completion of BTS-T or permission of instructor. Open only to rising Seniors during web registration, Juniors may add later if space is available.",397,"False","Prerequisites: ASIAN 275 or permission of the instructor and completion of BTS-T. Offered annually.","",1,"C",20141,"['T 0120-0245PM', 'Th 0215-0335PM']","Seminar: Human Rights/Asian Context","Research",2014,17
"366",94254,1,1361,"['SWRK']","Social work majors study the methods and skills of social work practice, particularly intercultural communication. They describe strengths and problems of diverse individuals and families; frame goals and plans for change utilizing the planned change process and the systems perspective; and use ethical decision-making, informed by the scientific method, grounded in the liberal arts, and concerned with social justice. Students demonstrate learning in recorded role playing and have an academic civic engagement experience. Prerequisites: SWRK 221 and concurrent enrollment in SWRK 246. Offered annually in the fall semester.","['ORC']",NA,"",NA,"['Susan E. Smalling']",200,"['HH 301', 'HH 301']","Incl Pract: Ind/Fam","Open to Junior Social Work majors only.",254,"False","Prerequisites: SWRK 221 and concurrent enrollment in SWRK 246. Offered annually in the fall semester.","",1,"O",20141,"['T 0120-0245PM', 'Th 0215-0335PM']","Inclusive Practice: Individuals and Families","Research",2014,18
"376",94272,1,1294,"['SOAN']","How do anthropologists study other cultures? Peoples around the world create different realities through the ways they conceptualize experience (cultures) and how they organize themselves to do what they need to do (societies). Anthropologists describe and compare cultures and societies, focusing on different aspects such as family and kinship, inequality and power, religion and values, economy and technology, cultural and social change. This course is open to first-year students or students in certain accredited programs. Offered each semester. Counts toward race and ethnic studies and women's and gender studies majors; and Africa and the Americas, race and ethnic studies, and women's and gender studies concentrations.","['HBS', 'MCG']",NA,"",NA,"['Marcel LaFlamme']",100,"['HH 514']","Int/Cult Anthropology","Open to first-year students only.",128,"False","False","A",1,"C",20141,"['MWF 1255-0150PM']","Introduction to Cultural Anthropology","Research",2014,18
"412",94314,1,1326,"['SPAN']","Through exploring the geographic and human diversity of the Spanish-speaking world, students develop increasingly complex skills for analyzing and communicating in Spanish. They study such essential dimensions of that world as: (1) geography and development; (2) environmental challenges and solutions; (3) population and demographic changes and challenges; and (4) ethnic diversity. Prerequisite: SPAN 112 or placement. Offered each semester and during Interim.","",NA,"",NA,"[""Jonathan P. O'Conner""]",200,"['TOH 310']","Intermed Spanish I","Prerequisite: Completion of Spanish placement test or preceding course.",231,"False","Prerequisite: SPAN 112 or placement. Offered each semester and during Interim.","A",1,"C",20141,"['MWF 0800-0855']","Intermediate Spanish I","Research",2014,16
"413",94315,1,1326,"['SPAN']","Through exploring the geographic and human diversity of the Spanish-speaking world, students develop increasingly complex skills for analyzing and communicating in Spanish. They study such essential dimensions of that world as: (1) geography and development; (2) environmental challenges and solutions; (3) population and demographic changes and challenges; and (4) ethnic diversity. Prerequisite: SPAN 112 or placement. Offered each semester and during Interim.","",NA,"",NA,"['Maggie Broner']",200,"['TOH 310']","Intermed Spanish I","Prerequisite: Completion of Spanish placement test or preceding course.",231,"False","Prerequisite: SPAN 112 or placement. Offered each semester and during Interim.","E",1,"C",20141,"['MWF 1045-1140']","Intermediate Spanish I","Research",2014,16
"414",94316,1,1326,"['SPAN']","Through exploring the geographic and human diversity of the Spanish-speaking world, students develop increasingly complex skills for analyzing and communicating in Spanish. They study such essential dimensions of that world as: (1) geography and development; (2) environmental challenges and solutions; (3) population and demographic changes and challenges; and (4) ethnic diversity. Prerequisite: SPAN 112 or placement. Offered each semester and during Interim.","",NA,"",NA,"['Gwendolyn Barnes-Karol']",200,"['TOH 110']","Intermed Spanish I","Prerequisite: Completion of Spanish placement test or preceding course.",231,"False","Prerequisite: SPAN 112 or placement. Offered each semester and during Interim.","B",1,"C",20141,"['MWF 0905-1000']","Intermediate Spanish I","Research",2014,14
"415",94317,1,1326,"['SPAN']","Through exploring the geographic and human diversity of the Spanish-speaking world, students develop increasingly complex skills for analyzing and communicating in Spanish. They study such essential dimensions of that world as: (1) geography and development; (2) environmental challenges and solutions; (3) population and demographic changes and challenges; and (4) ethnic diversity. Prerequisite: SPAN 112 or placement. Offered each semester and during Interim.","",NA,"",NA,"[""Jonathan P. O'Conner""]",200,"['TOH 310']","Intermed Spanish I","Prerequisite: Completion of Spanish placement test or preceding course.",231,"False","Prerequisite: SPAN 112 or placement. Offered each semester and during Interim.","C",1,"C",20141,"['MWF 0905-1000']","Intermediate Spanish I","Research",2014,16
"416",94318,1,1326,"['SPAN']","Through exploring the geographic and human diversity of the Spanish-speaking world, students develop increasingly complex skills for analyzing and communicating in Spanish. They study such essential dimensions of that world as: (1) geography and development; (2) environmental challenges and solutions; (3) population and demographic changes and challenges; and (4) ethnic diversity. Prerequisite: SPAN 112 or placement. Offered each semester and during Interim.","",NA,"",NA,"['Carla Manzoni']",200,"['OM 020']","Intermed Spanish I","Prerequisite: Completion of Spanish placement test or preceding course.",231,"False","Prerequisite: SPAN 112 or placement. Offered each semester and during Interim.","D",1,"C",20141,"['MWF 1045-1140']","Intermediate Spanish I","Research",2014,17
"417",94319,1,1326,"['SPAN']","Through exploring the geographic and human diversity of the Spanish-speaking world, students develop increasingly complex skills for analyzing and communicating in Spanish. They study such essential dimensions of that world as: (1) geography and development; (2) environmental challenges and solutions; (3) population and demographic changes and challenges; and (4) ethnic diversity. Prerequisite: SPAN 112 or placement. Offered each semester and during Interim.","",NA,"",NA,"['Barbara Olson']",200,"['TOH 310']","Intermed Spanish I","Prerequisite: Completion of Spanish placement test or preceding course.",231,"False","Prerequisite: SPAN 112 or placement. Offered each semester and during Interim.","F",1,"C",20141,"['MWF 1150-1245PM']","Intermediate Spanish I","Research",2014,11
