"","clbid","credits","crsid","departments","description","gereqs","groupid","grouptype","halfcredit","instructors","level","locations","name","notes","number","pn","prerequisites","section","semester","status","term","times","title","type","year","enrolled"
"418",94320,1,1326,"['SPAN']","Through exploring the geographic and human diversity of the Spanish-speaking world, students develop increasingly complex skills for analyzing and communicating in Spanish. They study such essential dimensions of that world as: (1) geography and development; (2) environmental challenges and solutions; (3) population and demographic changes and challenges; and (4) ethnic diversity. Prerequisite: SPAN 112 or placement. Offered each semester and during Interim.","",NA,"",NA,"['Kristina Medina-Vilarino']",200,"['TOH 114']","Intermed Spanish I","Prerequisite: Completion of Spanish placement test or preceding course.",231,"False","Prerequisite: SPAN 112 or placement. Offered each semester and during Interim.","G",1,"C",20141,"['MWF 1150-1245PM']","Intermediate Spanish I","Research",2014,12
"419",94321,1,1326,"['SPAN']","Through exploring the geographic and human diversity of the Spanish-speaking world, students develop increasingly complex skills for analyzing and communicating in Spanish. They study such essential dimensions of that world as: (1) geography and development; (2) environmental challenges and solutions; (3) population and demographic changes and challenges; and (4) ethnic diversity. Prerequisite: SPAN 112 or placement. Offered each semester and during Interim.","",NA,"",NA,"['Kristina Medina-Vilarino']",200,"['TOH 114']","Intermed Spanish I","Prerequisite: Completion of Spanish placement test or preceding course.",231,"False","Prerequisite: SPAN 112 or placement. Offered each semester and during Interim.","I",1,"C",20141,"['MWF 1255-0150PM']","Intermediate Spanish I","Research",2014,10
"420",94322,1,1326,"['SPAN']","Through exploring the geographic and human diversity of the Spanish-speaking world, students develop increasingly complex skills for analyzing and communicating in Spanish. They study such essential dimensions of that world as: (1) geography and development; (2) environmental challenges and solutions; (3) population and demographic changes and challenges; and (4) ethnic diversity. Prerequisite: SPAN 112 or placement. Offered each semester and during Interim.","",NA,"",NA,"['Ariel Strichartz']",200,"['TOH 316']","Intermed Spanish I","Prerequisite: Completion of Spanish placement test or preceding course.",231,"False","Prerequisite: SPAN 112 or placement. Offered each semester and during Interim.","H",1,"C",20141,"['MWF 1255-0150PM']","Intermediate Spanish I","Research",2014,11
"421",94323,1,1326,"['SPAN']","Through exploring the geographic and human diversity of the Spanish-speaking world, students develop increasingly complex skills for analyzing and communicating in Spanish. They study such essential dimensions of that world as: (1) geography and development; (2) environmental challenges and solutions; (3) population and demographic changes and challenges; and (4) ethnic diversity. Prerequisite: SPAN 112 or placement. Offered each semester and during Interim.","",NA,"",NA,"['Ariel Strichartz']",200,"['TOH 316']","Intermed Spanish I","Prerequisite: Completion of Spanish placement test or preceding course.",231,"False","Prerequisite: SPAN 112 or placement. Offered each semester and during Interim.","J",1,"C",20141,"['MWF 0200-0255PM']","Intermediate Spanish I","Research",2014,16
"422",94324,1,1326,"['SPAN']","Through exploring the geographic and human diversity of the Spanish-speaking world, students develop increasingly complex skills for analyzing and communicating in Spanish. They study such essential dimensions of that world as: (1) geography and development; (2) environmental challenges and solutions; (3) population and demographic changes and challenges; and (4) ethnic diversity. Prerequisite: SPAN 112 or placement. Offered each semester and during Interim.","",NA,"",NA,"['Staff']",200,"","Intermed Spanish I","The course has been canceled",231,"False","Prerequisite: SPAN 112 or placement. Offered each semester and during Interim.","K",1,"X",20141,"['MWF 0200-0255PM']","Intermediate Spanish I","Research",2014,0
"446",94352,1,1289,"['SOAN']","This course helps students explore the connections between society and their own lives. Students answer challenging questions such as ""Do we have a 'human nature'?,"" ""Why does social inequality exist?,"" ""What is race?,"" and ""How do societies change?"" In answering these questions students learn to develop a sociological imagination. In doing so they review the various research methods and theories that form the sociological tradition. This course is open to first-year students or students in certain accredited programs. Open to all students when taught during the summer. Offered each semester. Counts toward American studies major.","['HBS', 'MCD']",NA,"",NA,"['Ibtesam Al Atiyat']",100,"['HH 317', 'HH 317']","Intro to Sociology","Open to first-year students only.",121,"False","False","B",1,"C",20141,"['T 0120-0245PM', 'Th 0215-0335PM']","Introduction to Sociology","Research",2014,22
"447",94353,1,1289,"['SOAN']","This course helps students explore the connections between society and their own lives. Students answer challenging questions such as ""Do we have a 'human nature'?,"" ""Why does social inequality exist?,"" ""What is race?,"" and ""How do societies change?"" In answering these questions students learn to develop a sociological imagination. In doing so they review the various research methods and theories that form the sociological tradition. This course is open to first-year students or students in certain accredited programs. Open to all students when taught during the summer. Offered each semester. Counts toward American studies major.","['HBS', 'MCD']",NA,"",NA,"['Ibtesam Al Atiyat']",100,"['HH 317', 'HH 317']","Intro to Sociology","Open to first-year students only.",121,"False","False","A",1,"C",20141,"['T 0800-0925', 'Th 0800-0920']","Introduction to Sociology","Research",2014,17
"448",94354,1,1375,"['THEAT']","A broad-based introduction to the art and craft of theater, this course focuses on the roles of actor, director, playwright, and designer, as well as aspects of theater history, performance, and literature. Students examine theater as a culturally diverse art form, with emphasis on the ways ethnicity, gender, race, religion, and sexual orientation inform theater in the United States. Students attend performances on campus and in the Twin Cities and integrate them with readings, lectures, and discussions. A ticket fee is required. Offered each semester.","['ALS-A', 'MCD', 'ORC']",NA,"",NA,"['Jeanne I. Willcoxon']",100,"['TB Kelsey']","Intro to Theater","",110,"False","False","",1,"C",20141,"['MWF 0905-1000']","Introduction to Theater","Research",2014,52
"500",94409,1,285,"['ECON']","","",NA,"",NA,"['Ashley Hodgson']",300,"","IR/MCO Appeals and Race","",398,"False","False","A",1,"O",20141,"","Independent Research","Research",2014,1
"582",94532,1,625,"['HIST']","","",NA,"",NA,"['Abdulai Iddrisu']",200,"","IS/US Afric Pol 1960-2014","",298,"False","False","A",1,"O",20141,"","Independent Study","Research",2014,1
"591",94548,1,1316,"['SOAN']","","",NA,"",NA,"['Thomas A. Williamson']",200,"","IS/Native American Health","",298,"False","False","A",1,"O",20141,"","Independent Study","Research",2014,1
"653",94690,1,1122,"['PSCI']","Some formerly developing countries have found the way to join the ranks of the industrialized nations, others have not. What explains the difference? By introducing students to theories of modernization, dependency, world systems, order, class, revolution, state, and political economy, the course attempts to provide the framework for answering this question. Counts toward Latin American studies major and concentration.","['HBS', 'MCG']",NA,"",NA,"['Kristina Thalhammer']",200,"['HH 516']","Politics & Developmnt","",252,"False","False","A",1,"C",20141,"['MWF 0800-0855']","Politics and Development","Research",2014,21
"693",94741,1,178,"['AMCON']","Burgeoning cities and industrialism, an emerging market economy, changing opportunities for women, an influx of immigrants, and the migration of African Americans to urban centers -- all opened questions of freedom of expression, distribution of resources, and American identity. Topics and texts range from the Statue of Liberty and the World's Columbian Exposition to the Model T Ford and the Harlem Renaissance. Prerequisite: AMCON 101 and 102. Offered annually in the fall semester. Counts towards American studies major.","['ALS-L', 'MCD', 'WRI']",NA,"",NA,"['Mark Allister']",200,"['HH 307']","Remaking Am: 1865-1945","Open to American Conversations students only.",201,"False","Prerequisite: AMCON 101 and 102. Offered annually in the fall semester. Counts towards American studies major.","A",1,"C",20141,"['MWF 1150-1245PM']","Remaking America, 1865-1945","Research",2014,16
"694",94742,1,178,"['AMCON']","Burgeoning cities and industrialism, an emerging market economy, changing opportunities for women, an influx of immigrants, and the migration of African Americans to urban centers -- all opened questions of freedom of expression, distribution of resources, and American identity. Topics and texts range from the Statue of Liberty and the World's Columbian Exposition to the Model T Ford and the Harlem Renaissance. Prerequisite: AMCON 101 and 102. Offered annually in the fall semester. Counts towards American studies major.","['ALS-L', 'MCD', 'WRI']",NA,"",NA,"['Matthew Rohn']",200,"['HH 319']","Remaking Am: 1865-1945","Open to American Conversations students only.",201,"False","Prerequisite: AMCON 101 and 102. Offered annually in the fall semester. Counts towards American studies major.","B",1,"C",20141,"['MWF 1150-1245PM']","Remaking America, 1865-1945","Research",2014,13
"721",94801,1,23948,"['HIST']","This course introduces students to the historical forces leading to and scholarly debates about slavery in African history. Students examine the nature and development of domestic slavery to the 19th century as well as the slave trade systems across the Saharan Desert and the Atlantic Ocean. Students ""do history"" using primary sources to retrieve the African voices and agency in discussions of the slave trade and debate themes such as ethnicity, kinship, state formation, and colonialism. Offered annually. Counts toward Africa and the Americas concentration.","['MCG']",NA,"",NA,"['Abdulai Iddrisu']",100,"['HH 516', 'HH 516']","Slavery in African Hist","Open to first-year students only.",151,"False","False","",1,"O",20141,"['T 0935-1100', 'Th 0930-1050']","Slavery in African History","Research",2014,7
"726",94810,1,1340,"['SPAN']","Students explore the processes involved in the acquisition of Spanish as a first and second language and the variation present in the language of both native and non-native speakers of Spanish from Spain, Latin America, and the U.S. Hispanic linguistics are studied with special attention paid to the socio-cultural as well as structural aspects. The course includes the study of at least one substantive literary work. Includes pronunciation lab. Taught in Spanish. Prerequisite: SPAN 250. Offered each semester.","",NA,"",NA,"['Maggie Broner']",200,"['TOH 310']","Spanish 1st/2nd Lang","",276,"False","Prerequisite: SPAN 250. Offered each semester.","",1,"C",20141,"['MWF 0200-0255PM']","Spanish as a First and Second Language","Research",2014,17
"788",94900,1,492,"['FREN']","Students explore a specified topic or theme in language, in literature, or in culture/civilization, or in a combination of these, through close reading, discussion, analysis, and interpretation of selected literary and/or non-literary works. Sample topics include ""Madness and the Romantic Dream,"" ""Female Identity in Post-Colonial North Africa,"" and ""Global Francophone Identities."" May be repeated if topics are different. Taught in French. Prerequisite: minimum of one 270-level course.","['WRI']",NA,"",NA,"['Jolene Barjasteh']",300,"['TOH 108', 'TOH 108']","Top: War/Francophone Lit","",372,"False","Prerequisite: minimum of one 270-level course.","",1,"O",20141,"['T 0120-0245PM', 'Th 0215-0335PM']","Topics in Francophone Studies","Topic",2014,8
"800",94978,1,829,"['MUSIC']","An introduction to the diversity of musics on Earth. Topics include performance practice, methods for analysis and comparison of various musics, and interdisciplinary approaches to studying the powerful influence of music in human life. Offered annually in the fall semester. Counts towards race and ethnic studies major and concentration","['ALS-A', 'MCG']",NA,"",NA,"['David Hagedorn']",200,"['CHM 233']","World Music","",237,"False","False","",1,"C",20141,"['MWF 1045-1140']","","Research",2014,63
"806",96971,1,27762,"['ASIAN']","This interdisciplinary course introduces the field of Asian American Studies and the multiple cultural and historical productions of Asia and America, from art and film to food and lifestyles. Critical analysis of topics such as ethnic/cultural identities, stereotypes, citizenships, media/pop cultures, body images, sexuality, practices of different Asian communities, and various contemporary issues are explored through interactive in-class activites, films, presentations, and field trips. Counts toward Asian studies and race and ethnic studies major and Asian studies, China studies, Japan studies, and race and ethnic studies concentrations. Offered alternate years.","['MCD', 'ORC']",NA,"",NA,"['Ka F. Wong']",100,"['TOH 114', 'TOH 114']","Asia in America","",123,"False","False","",1,"C",20141,"['T 0120-0245PM', 'Th 0215-0335PM']","","Research",2014,24
"810",96984,1,19726,"['ASIAN']","This course offers in-depth study of a topic. The specific topic depends on the instructor. The course may be repeated if topics are different. Offered periodically.","",NA,"",NA,"['Staff']",300,"['TOH 114', 'TOH 114']","Top: E Asian Lang/Ling","This course has been canceled.",300,"False","False","",1,"X",20141,"['T 1145-0110PM', 'Th 1245-0205PM']","Topics in Asian Studies","Topic",2014,0
"812",97012,1,1300,"['SOAN']","What do self-determination and cultural identity mean for Native American peoples today? Students examine the impact of colonization on Native American peoples, including federal policies, treaty rights, and sovereignty. Issues include economy and politics on reservations, family and gender roles, orality and literacy, persistence and revitalization of religious life and culture, urban life, and recent social movements and organizations. Offered every other year in the fall semester. Counts towards American studies major and race and ethnic studies major and concentration.","['HBS', 'MCD']",NA,"",NA,"['Staff']",200,"['OM 210']","Contemp Native Am","This course has been canceled.",242,"False","False","A",1,"X",20141,"['MWF 0905-1000']","Contemporary Native American Issues","Research",2014,0
"813",97013,1,1300,"['SOAN']","What do self-determination and cultural identity mean for Native American peoples today? Students examine the impact of colonization on Native American peoples, including federal policies, treaty rights, and sovereignty. Issues include economy and politics on reservations, family and gender roles, orality and literacy, persistence and revitalization of religious life and culture, urban life, and recent social movements and organizations. Offered every other year in the fall semester. Counts towards American studies major and race and ethnic studies major and concentration.","['HBS', 'MCD']",NA,"",NA,"['Staff']",200,"['OM 210']","Contemp Native Am","This course has been canceled.",242,"False","False","B",1,"X",20141,"['MWF 1045-1140']","Contemporary Native American Issues","Research",2014,0
"815",97027,1,556,"['HIST']","This course explores the origins of the modern Russian empire. Using primary sources including chronicles, folktales, legal codes, letters, and religious icons, students consider Russia's development from a loose collection of princedoms into a powerful, multi-ethnic empire spanning 11 time zones. Topics include the impact of geography and climate, the Orthodox religion, Mongol rule, gender roles, the rise of autocracy, and social rebellion. Offered most years. Counts toward women's and gender studies major and concentration.","['HWC']",NA,"",NA,"['Anna Kuxhausen']",100,"['HH 302']","Making Modern Russia","Open to first-year students only.",121,"False","False","",1,"C",20141,"['MWF 0200-0255PM']","The Making of Modern Russia","Research",2014,17
"821",97039,1,618,"['HIST']","In this study of African-Americans in U. S. society from African origins to the present, students explore the African heritage, the experience of slavery, segregation, and the rise of the Civil Rights movement of the 1960s. The course pays particular attention to the issue of black nationalism as a force in American life. Offered most years. Counts toward American studies and race and ethnic studies majors and race and ethnic studies and Africa and the Americas concentrations.","['HWC', 'MCD']",NA,"",NA,"['Michael Fitzgerald']",200,"['HH 413', 'HH 413']","African-American Hist","",277,"False","False","",1,"C",20141,"['T 1145-0110PM', 'Th 1245-0205PM']","African-American History","Research",2014,27
"838",97107,1,25848,"['ENGL']","Exciting writing in English is coming from South Asia: India, Pakistan, Bangladesh, and Sri Lanka. An area once shaped by British colonization, South Asia is changing rapidly now with globalization. Students explore this area's history, culture, and religion by reading literature that tells compelling stories about individuals and groups that seem far different and far away from 21st-century Minnesota. Prerequisite: FYW. Offered periodically.","['ALS-L']",NA,"",NA,"['Joseph L. Mbele']",200,"['RML 515']","South Asian Literature","",204,"False","Prerequisite: FYW. Offered periodically.","",1,"C",20141,"['MWF 1255-0150PM']","","Research",2014,30
"839",97108,1,25188,"['ENGL']","After the Second World War, Britain experienced a surge in immigration from the Caribbean, South Asia, and Africa, a crucial step in the transformation of Britain into a multiracial, multicultural nation. Over the past several decades, these immigrants and their descendants have crafted distinct bodies of work in literature, film, music, and visual art. This course is a broad, multi-genre introduction to their work with particular emphasis on its historical and cultural context. Prerequisite: FYW. Offered periodically.","['ALS-L', 'MCG']",NA,"",NA,"['Jonathan T. Naito']",200,"['RML 515', 'RML 515']","Black & Asian Brit Lit","",208,"False","Prerequisite: FYW. Offered periodically.","",1,"C",20141,"['T 0120-0245PM', 'Th 0215-0335PM']","Black and Asian British Literatures","Research",2014,29
"847",97117,1,486,"['FREN']","Students explore French-speaking regions of the world outside France through the close reading, discussion, and analysis of literary and non-literary texts as well as other cultural artifacts. Readings, discussions, viewings, and written and oral assignments are organized around the exploration of specific topics or themes. May be repeated if geographical region is different. Taught in French. Prerequisite: minimum of one 250-level course (two recommended). Counts towards Africa and the Americas concentration when topic is Francophone Africa.","",NA,"",NA,"['Maria Vendetti']",200,"['TOH 108', 'TOH 108']","Fr World: The Maghreb","",271,"False","Prerequisite: minimum of one 250-level course (two recommended). Counts towards Africa and the Americas concentration when topic is Francophone Africa.","",1,"C",20141,"['T 1145-0110PM', 'Th 1245-0205PM']","The Francophone World","Research",2014,17
"857",97128,1,979,"['PHIL']","This course examines the main Western ethical theories and their application to contemporary moral concerns. Theoretical issues may include rights, duties, virtue, hedonism, egoism, the relation between ethics and theology, the fact-value distinction, relativism, and pluralism. Students discuss current topics such as global economic justice, euthanasia, the death penalty, animal rights, censorship, racism, privacy rights versus public safety, reproductive ethics, and environmental ethics. Prerequisite: completion of BTS-T or permission of instructor. Offered annually. Counts toward biomedical studies concentration (for students through class of 2016).","['EIN', 'WRI']",NA,"",NA,"['Jason Marsh']",200,"['HH 317']","Ethics/The Good Life","Prerequisite: Completion of BTS-T or permission of instructor. Open only to rising Seniors and Juniors during web registration.",252,"False","Prerequisite: completion of BTS-T or permission of instructor. Offered annually. Counts toward biomedical studies concentration (for students through class of 2016).","B",1,"C",20141,"['MWF 1255-0150PM']","Ethics and the Good Life","Research",2014,19
"861",97132,1,1122,"['PSCI']","Some formerly developing countries have found the way to join the ranks of the industrialized nations, others have not. What explains the difference? By introducing students to theories of modernization, dependency, world systems, order, class, revolution, state, and political economy, the course attempts to provide the framework for answering this question. Counts toward Latin American studies major and concentration.","['HBS', 'MCG']",NA,"",NA,"['Kristina Thalhammer']",200,"['HH 516']","Politics & Developmnt","",252,"False","False","B",1,"C",20141,"['MWF 0905-1000']","Politics and Development","Research",2014,22
"862",97133,1,1127,"['PSCI']","Often controversial, U.S.-Latin American relations occupy a special place in the foreign policy of the United States. Students compare differing views of political issues of importance to both regions and explore the emergence of U.S. power, interventionism, cooperation, revolution, collective security, the transition to democracy, and the influence of economic factors on the relationship between Latin America and the U.S. Counts toward Latin American studies major and concentration.","",NA,"",NA,"['Kristina Thalhammer']",200,"['TOH 212']","US/Latin Am Relations","",257,"False","False","",1,"C",20141,"['MWF 1255-0150PM']","U.S. - Latin American Relations","Research",2014,17
"879",97152,1,1346,"['SPAN']","Students explore one or more periods, genres, or topics from Pre-Columbian times to the 21st century. Selected literary works are analyzed within their socio-historical and cultural contexts and in reference to pertinent critical or theoretical issues. Sample topics include: The Shaping of Latin America; Personalism and Politics; Love and Magical Realism; and Literary Representations of Kitchens, Cooking, and Eating in Latin America. Students may register more than once, provided topics differ. Taught in Spanish. Prerequisite: SPAN 275.","['ALS-L']",NA,"",NA,"['Sylvia Carullo']",300,"['TOH 314', 'TOH 314']","Lit/Soc/LA: Fem Lit Portr","Full course title: Female Literary Portraits",314,"False","Prerequisite: SPAN 275.","",1,"C",20141,"['T 0120-0245PM', 'Th 0215-0335PM']","Literature and Society in Latin America","Topic",2014,17
"882",97155,1,794,"['MEDIA']","This course focuses on contemporary media from theoretical and critical perspectives. Primary emphasis is given to the specific identifying characteristics of news, advertising, entertainment, and social media and to how those media serve as forums for cultural negotiation in our society. In particular, attention is paid to how media representations of race, class and gender presently exist as both products and producers of contemporary cultures. Prerequisite: MEDIA 160. Counts towards American studies and women's and gender studies majors and film studies and women's and gender studies concentrations.","['ORC']",NA,"",NA,"['William Sonnega']",200,"['TB 216', 'TB 216']","Media/Contemp Culture","",260,"False","Prerequisite: MEDIA 160. Counts towards American studies and women's and gender studies majors and film studies and women's and gender studies concentrations.","",1,"C",20141,"['T 1145-0110PM', 'Th 1245-0205PM']","Media and Contemporary Culture","Research",2014,19
"891",97217,1,27941,"['ASIAN']","This course considers works of Japanese anime from the post-World War II period to the present. The course begins with an introduction to the language and theory of Anime Studies. In subsequent weeks, students watch and analyze a variety of anime genres. This course employs a comparative approach to the study of anime; each anime is paired with excerpts from germane works of philosophy or literature. All anime viewed for this course include English subtitling. Counts toward Asian studies major and Japan studies, film studies, and media studies concentrations. FLAC component available.","['ALS-L', 'MCG']",NA,"",NA,"['William H. Bridges IV']",200,"['TOH 210']","The Philosophy of Anime","",230,"False","False","",1,"C",20141,"['MWF 0200-0255PM']","","Research",2014,30
"907",97378,1,616,"['HIST']","This course surveys women's experience in American life from the colonial period to the present. Students examine the changing economic, social, and legal status of women, society's attitudes toward women, and the growth of feminism. Offered most years. Counts toward American studies major, women's and gender studies major and concentration, and family studies concentration.","['HWC', 'MCD']",NA,"",NA,"['Judy Kutulas']",200,"['HH 501']","Women in America","",272,"False","False","",1,"C",20141,"['MWF 0905-1000']","","Research",2014,35
