"","clbid","credits","crsid","departments","description","gereqs","groupid","grouptype","halfcredit","instructors","level","locations","name","notes","number","pn","prerequisites","section","semester","status","term","times","title","type","year","enrolled"
"908",97381,1,608,"['ASIAN', 'HIST']","This course studies Chinese civilization from its beginnings to the end of the 19th century, providing an overview of traditional Chinese thought, culture, institutions, and society. Students examine the development of philosophy and religion, achievements in art and literature, and social and economic change. This course also considers foreign conquest dynasties, Chinese expansion into Inner Asia, and China's relations with the West. Foreign Language Across the Curriculum course available in Chinese for students at the third-year level in the language. Offered most years.","['MCG']",NA,"",NA,"['Robert Entenmann']",200,"['TOH 114']","Chinese Civilization","",250,"False","False","",1,"O",20141,"['MWF 0200-0255PM']","","Research",2014,16
"910",97394,1,1294,"['SOAN']","How do anthropologists study other cultures? Peoples around the world create different realities through the ways they conceptualize experience (cultures) and how they organize themselves to do what they need to do (societies). Anthropologists describe and compare cultures and societies, focusing on different aspects such as family and kinship, inequality and power, religion and values, economy and technology, cultural and social change. This course is open to first-year students or students in certain accredited programs. Offered each semester. Counts toward race and ethnic studies and women's and gender studies majors; and Africa and the Americas, race and ethnic studies, and women's and gender studies concentrations.","['HBS', 'MCG']",NA,"",NA,"['Christopher L. Chiappari']",100,"['OM 140', 'OM 140']","Int/Cult Anthropology","Open to first-year students only.",128,"False","False","B",1,"C",20141,"['T 0800-0925', 'Th 0800-0920']","Introduction to Cultural Anthropology","Research",2014,21
"911",97395,1,1294,"['SOAN']","How do anthropologists study other cultures? Peoples around the world create different realities through the ways they conceptualize experience (cultures) and how they organize themselves to do what they need to do (societies). Anthropologists describe and compare cultures and societies, focusing on different aspects such as family and kinship, inequality and power, religion and values, economy and technology, cultural and social change. This course is open to first-year students or students in certain accredited programs. Offered each semester. Counts toward race and ethnic studies and women's and gender studies majors; and Africa and the Americas, race and ethnic studies, and women's and gender studies concentrations.","['HBS', 'MCG']",NA,"",NA,"['Christopher L. Chiappari']",100,"['OM 140', 'OM 140']","Int/Cult Anthropology","Open to first-year students only.",128,"False","False","C",1,"C",20141,"['T 0935-1100', 'Th 0930-1050']","Introduction to Cultural Anthropology","Research",2014,19
"949",97496,1,27993,"['ASIAN']","","['ALS-A', 'MCG', 'WRI']",NA,"",NA,"['Karil J. Kucera']",200,"['DC 204']","Top: Sacred Sites of Asia","",202,"False","False","",1,"C",20141,"['MWF 1045-1140']","","Topic",2014,19
"975",98889,1,569,"['HIST']","Students examine the overthrow of American segregation through several decades of agitation for civil rights. This seminar focuses primarily on the South, though students also discuss northern race relations. Primary accounts from the era constitute the assigned readings. Among the topics covered are the segregated South, Martin Luther King and his critics, the Black Power movement, and the rise of white backlash politics. Offered periodically. Counts towards race and ethnic studies and American studies majors and race and ethnic studies and Africa and the Americas concentrations.","['HWC', 'MCD']",NA,"",NA,"['Michael Fitzgerald']",100,"['HH 514']","Civil Rights Revolution","Open to first-year students only.",181,"False","False","",1,"O",20141,"['MWF 1045-1140']","","Research",2014,13
"993",98975,1,18613,"['AFAM']","","",NA,"",NA,"['Abdulai Iddrisu']",200,"","IS/Discourse Imperialism","",298,"False","False","A",1,"O",20141,"","Independent Study","Research",2014,1
