"clbid","credits","crsid","departments","description","groupid","grouptype","halfcredit","instructors","level","locations","name","notes","number","pn","prerequisites","section","semester","status","term","times","title","type","year"
"10217","1.0","4","['AMST']","This analysis of modern American society introduces theories and methods of culture studies, beginning with anthropological definitions of culture and including perspectives of sociology, political science, history, art history and English. Students examine the moral ecology of everyday life in America, looking at the cultural meanings of work, clothes, food, family, gender, buildings, bodies, television, advertising and education.","","","","['James Farrell']","100","['RML 421']","Perspect Am Culture","","100","False","False","","1","C","20051","['MWF 1045-1140']","American Culture: Interdisciplinary Perspectives","Research","2005"
"10218","1.0","11","['AMST']","","","","","['Staff']","200","","Academic Internship","","294","True","False","","1","O","20051","","Internship","Research","2005"
"10219","1.0","12","['AMST']","","","","","['James Farrell']","200","","IS/Campus Ecology II","","298","False","False","","1","O","20051","","Independent Study","Research","2005"
"10220","1.0","12","['AMST']","","","","","['Staff']","200","","IS/","","298","False","False","A","1","O","20051","","Independent Study","Research","2005"
"10221","1.0","14","['AMST']","","","","","['Staff']","300","","Academic Internship","","394","True","False","","1","O","20051","","Internship","Research","2005"
"10222","1.0","15","['AMST']","","","","","['Staff']","300","","IR/","","398","False","False","","1","O","20051","","Independent Research","Research","2005"
"10223","1.0","15","['AMST']","","","","","['Staff']","300","","IR/","","398","False","False","A","1","O","20051","","Independent Research","Research","2005"
"10224","0.5","19","['ART']","This course provides a strong visual foundation in fundamental drawing skills. Students explore elements of line, space, texture and value, as well as their dynamics in composition. Projects emphasize translating observed three-dimensional subjects onto two-dimensional surfaces. In addition, students are introduced to the aesthetics of drawing and drawing as a means of self-expression through the study of old and contemporary masters. Lab fee.","","","","['John Saurer']","100","['DC 216']","Found Perceptual Draw","","111","False","False","A","1","O","20051","['MWF 1255-0150PM']","Foundation Perceptual Drawing","Research","2005"
"10225","0.5","19","['ART']","This course provides a strong visual foundation in fundamental drawing skills. Students explore elements of line, space, texture and value, as well as their dynamics in composition. Projects emphasize translating observed three-dimensional subjects onto two-dimensional surfaces. In addition, students are introduced to the aesthetics of drawing and drawing as a means of self-expression through the study of old and contemporary masters. Lab fee.","","","","['John Saurer']","100","['DC 216']","Found Perceptual Draw","","111","False","False","B","1","O","20051","['MWF 0200-0255PM']","Foundation Perceptual Drawing","Research","2005"
"10226","0.5","20","['ART']","Emphasizing concepts and ideas and using drawing as a means of expression, this studio course for majors and non-majors delves into the dynamics of composition and design principles through the use of a variety of techniques and media. It couples drawing assignments with viewing and discussing contemporary and old masterpieces to broaden appreciation and understanding of drawing as a method of visual communication. Lab fee.","","","","['Jil Evans']","100","['DC 216', 'DC 216']","Found Conceptual Draw","","112","False","False","","1","O","20051","['T 0935-1100', 'Th 0930-1050']","Foundation Conceptual Drawing","Research","2005"
"10227","0.5","21","['ART']","Within an art historical context, this course explores an appreciation of color and the interaction of color as it affects one's daily life. Problems are developed to foster investigation and experimentation into the formal properties of color theory and expand creativity in the painter's approach to composition and expressive content. Materials fee.","","","","['Wendell Arneson']","100","['DC 116']","Found Color Design","","113","False","False","A","1","O","20051","['MWF 0905-1000']","Foundation Color Design","Research","2005"
"10228","0.5","21","['ART']","Within an art historical context, this course explores an appreciation of color and the interaction of color as it affects one's daily life. Problems are developed to foster investigation and experimentation into the formal properties of color theory and expand creativity in the painter's approach to composition and expressive content. Materials fee.","","","","['Wendell Arneson']","100","['DC 116']","Found Color Design","","113","False","False","B","1","O","20051","['MWF 1045-1140']","Foundation Color Design","Research","2005"
"10229","0.5","22","['ART']","This beginning studio course in sculpture introduces the basic aesthetic, conceptual and technical fundamentals of three-dimensional art-making and design. Students learn how to operate tools safely and efficiently, how to construct things with wood and other materials and how to describe and discuss sculpture and other objects and spaces. The course uses hands-on instruction, readings, slide talks, field trips and discussion. Lab fee.","","","","['Irve Dell']","100","['DC 106', 'DC 106']","Foundation Sculpture","","114","False","False","A","1","O","20051","['T 0935-1100', 'Th 0930-1050']","","Research","2005"
"10230","0.5","22","['ART']","This beginning studio course in sculpture introduces the basic aesthetic, conceptual and technical fundamentals of three-dimensional art-making and design. Students learn how to operate tools safely and efficiently, how to construct things with wood and other materials and how to describe and discuss sculpture and other objects and spaces. The course uses hands-on instruction, readings, slide talks, field trips and discussion. Lab fee.","","","","['Irve Dell']","100","['DC 106', 'DC 106']","Foundation Sculpture","","114","False","False","B","1","O","20051","['T 0305-0430PM', 'Th 0355-0515PM']","","Research","2005"
"10231","0.5","23","['ART']","This course introduces students to black and white photography and to fundamental elements in visual art, as well as to the aesthetics and history of photography and the role of photography in modern culture. Students learn camera operation, black and white film processing, printing and print presentation. Students must provide their own 35 mm camera. With the exception of art majors, credit not allowed also for Physics 120. Lab fee.","","","","['Margaret Ojala']","100","['DC 102', 'DC 102']","Found Photography","","115","False","False","","1","O","20051","['T 0800-0925', 'Th 0800-0920']","Foundation Photography","Research","2005"
"10232","0.5","24","['ART']","In this introductory course that employs handbuilding techniques, the primary emphasis of the class is the student's imaginative approach in solving visual problems. Students are introduced to historical/contemporary approaches to clay. Included in the course are clay mixing, kiln loading, various firing procedures and glaze and surface embellishment. Lab fee.","","","","['Ron Gallas']","100","['DC 115C', 'DC 115C']","Found Ceramics: Hand","","116","False","False","","1","O","20051","['T 0305-0430PM', 'Th 0355-0450PM']","Foundation Ceramics -- Handbuilding","Research","2005"
"10233","0.5","25","['ART']","This course provides the technical and conceptual foundations for use of digital media for artistic expression. The course will focus on the interaction of the conceptual and the technical through readings, lecture and assignments that address fundamental issues of digital arts: digital reproduction and representation, intermedia and interface. Students will acquire basic technical skills and apply them in the development of digital art projects that span four realms: raster graphics, vector graphics, 3D graphics and web page construction. This course will prepare students for advanced art courses in the curriculum: Motion Graphics, Computer-Based Imagery and Video Art Production.","","","","['Patrick T. Kelley']","100","['DC 100', 'DC 100']","Found Digital Media","","117","False","False","A","1","C","20051","['T 0800-0925', 'Th 0800-0920']","Foundation Digital Media","Research","2005"
"10234","0.5","25","['ART']","This course provides the technical and conceptual foundations for use of digital media for artistic expression. The course will focus on the interaction of the conceptual and the technical through readings, lecture and assignments that address fundamental issues of digital arts: digital reproduction and representation, intermedia and interface. Students will acquire basic technical skills and apply them in the development of digital art projects that span four realms: raster graphics, vector graphics, 3D graphics and web page construction. This course will prepare students for advanced art courses in the curriculum: Motion Graphics, Computer-Based Imagery and Video Art Production.","","","","['Patrick T. Kelley']","100","['DC 100', 'DC 100']","Found Digital Media","","117","False","False","B","1","O","20051","['T 0935-1100', 'Th 0930-1050']","Foundation Digital Media","Research","2005"
"10235","0.5","26","['ART']","This introductory course employs wheel throwing techniques in clay. Students are introduced to historical and contemporary approaches to clay. Course includes clay mixing, kiln loading, various firing procedures and glaze and surface embellishment. Lab fee.","","","","['Ron Gallas']","100","['DC 115E', 'DC 115E']","Found Ceramics: Wheel","","119","False","False","","1","O","20051","['T 1145-0110PM', 'Th 1245-0205PM']","Foundation Ceramics -- Wheel Throwing","Research","2005"
"10236","1.0","27","['ART']","In this accelerated course in design and drawing, students explore the art elements and their dynamics in composition and experiment with a wide range of media and techniques. Students sharpen their skills in rendering and develop ways to use drawing to convey personal meaning and ideas. Students also study and discuss the technique, content and the context of works by contemporary artists and old masters. This course meets the requirements of 1/2 of the requirements of the foundation program; two additional foundation courses must be taken, one of which must be in three-dimensional studies. Admission to this course is by portfolio review only. Lab fee.","","","","['Jil Evans']","100","['DC 216', 'DC 216']","Honors Found Drawing","","120","False","False","","1","C","20051","['T 1145-0245PM', 'Th 1245-0345PM']","Honors Foundation Drawing","Research","2005"
"10237","1.0","31","['ART']","This introduction to the materials and concepts of art history is aimed at first-year students, sophomores and beginning majors. It provides a chronological survey of the painting, sculpture, architecture and decorative arts of the West. Students learn visual analysis and key art historical terminology along with the extraordinary cultural contexts and heritages informing this art.","","","","['Nancy M. Thompson', 'Karil J. Kucera']","100","['DC 305']","Intro/Art History I","","150","False","False","","1","O","20051","['MWF 1045-1140']","Ancient through Medieval Art","Research","2005"
"10238","1.0","33","['ART']","This course develops and stimulates research into the emotional/expressive properties of art-making in the painting media. By investigating thematic compositional and technical problems, students develop a personalized approach to ideas and content. Students learn the importance of process, need for flexibility, how to seek alternatives and how to recognize that a painting has a life of its own. Prerequisites: Art 111 and 112 (or 120), and 113 . Materials fee. Offered annually.","","","","['Wendell Arneson']","200","['DC 214']","Oil/Acrylic Painting","","221","False","Prerequisites: Art 111 and 112 (or 120), and 113 . Materials fee. Offered annually.","","1","C","20051","['MWF 1255-0255PM']","","Research","2005"
"10239","1.0","35","['ART']","This sculpture course introduces lost wax bronze casting, an art and industrial process that changed the course of human civilization. Students learn to cast, finish and preset cast metal work, building upon concepts from the foundation course and exploring the next level of sculpture topics, issues and concern. Te course makes use of hands-on instruction, readings, slide talks and discussion. Lab fee. Prerequisite: Art 114 (Mandatory); Art 111, 112, 113, 116(recommended). Offered annually. Fall Semester only.","","","","['Irve Dell']","200","['DC 105', 'DC 105']","Sculpt: Metal Casting","","223","False","Prerequisite: Art 114 (Mandatory); Art 111, 112, 113, 116(recommended). Offered annually. Fall Semester only.","","1","O","20051","['T 1145-0245PM', 'Th 1245-0345PM']","Sculpture/Metal Casting","Research","2005"
"10240","1.0","37","['ART']","Through a sequence of projects, architectural design students learn about drawing (hand drafting and computer-aided drawing and design) and architectural design processes which require the integration of social, artistic, technical and environmental issues. Prerequisites: Art 111 and 112 (or 120). Lab fee.","","","","['Steven Edwins']","200","['DC 116']","Arch Drawing/Design I","","225","False","Prerequisites: Art 111 and 112 (or 120). Lab fee.","","1","O","20051","['MWF 1255-0255PM']","Architectural Drawing and Design I","Research","2005"
"10241","1.0","39","['ART']","This course provides a strong foundation in the array of copper plate processes of etching, aquatint, lift ground, soft ground and viscosity color printmaking processes as well as in painterly monoprinting techniques. Students address personal sources of ideas, experimentation, drawing skills and compositional concerns and draw upon examples of master printmakers to discuss how images reflect culture. Critical thinking skills are necessary in discussion and critiques. Prerequisites: Prerequisites: Art 111 and 112 (or 120), and 113. Lab fee. Offered annually.","","","","['John Saurer']","200","['DC 212']","Printmkg: Intaglio/Mono","","227","False","Prerequisites: Prerequisites: Art 111 and 112 (or 120), and 113. Lab fee. Offered annually.","","1","O","20051","['MWF 1045-1245PM']","Printmaking: Intaglio and Monoprints","Research","2005"
"10242","1.0","43","['ART']","Drawing the human form from life has been a mainstay in the training of artists since the Renaissance because of its unparalleled discipline in the training of the eye. Along with becoming better observers, students reach a personal understanding of the figure and an appreciation of its art historical uses. Various media and techniques are explored as a means to understand the expressive possibilities of the figure. Prerequisites: Art 111 and 112 (or 120), and 113. Offered annually.","","","","['John Saurer']","200","['DC 216']","Figure Drawing","","232","False","Prerequisites: Art 111 and 112 (or 120), and 113. Offered annually.","","1","O","20051","['MWF 0800-1000']","","Research","2005"
"10243","1.0","46","['ART']","In this intermediate photography course, students explore a variety of techniques and topics. Techniques include historic processes such as cyanotype and salted paper printing, digital photography, Polaroid materials and traditional black and white photography. Experimental approaches and nontraditional forms for presentation are investigated. Photography is investigated from a broad historical, aesthetic and social perspective. This course includes field trips, readings, discussion and slide presentations. Prerequisites: Art 115 or 124, or equivalent. Lab fee. Offered annually.","","","","['Margaret Ojala']","200","['DC 102', 'DC 102']","Intermed Photography","","238","False","Prerequisites: Art 115 or 124, or equivalent. Lab fee. Offered annually.","","1","C","20051","['T 1145-0245PM', 'Th 1245-0345PM']","Intermediate Photography","Research","2005"
"10244","1.0","47","['ART']","This course explores video as a creative medium. Students learn basic video production and editing techniques, producing a number of individual and group projects. During the semester we examine a wide variety of videos and films, exploring experimental, documentary and narrative approaches. The class also considers the history of video art and its relationship to other time-based and static art forms. Prerequisites: Art 111 and 113 or permission of instructor. Lab fee. Offered annually.","","","","['David E. Ryan']","200","['DC 101', 'DC 101']","Video Art Production","","239","False","Prerequisites: Art 111 and 113 or permission of instructor. Lab fee. Offered annually.","","1","O","20051","['T 1145-0245PM', 'Th 1245-0345PM']","","Research","2005"
"10245","1.0","50","['ART']","Painting, sculpture, and architecture are studied through an introductory exploration of the art and 19th-century European and American cultural and historical forces relating to it. The course examines Neo-Classical art as it expresses Enlightenment thinking, the tumultuous Romantic and Realist imagery and times and ends with Impressionism.","","","","['Heather M. Brooks-Shirey']","200","['DC 305', 'DC 305']","Art 1776-1880","","251","False","False","","1","O","20051","['T 1145-0110PM', 'Th 1245-0205PM']","Art 1776-1880, Origins of Modernism","Research","2005"
"10246","1.0","51","['ART']","This course introduces modern culture and thought through a chronological study of painting, sculpture, architecture, and related arts. Students learn about the strikingly new modes of art created in Europe and the United States after 1880, examining work by Edvard Munch, Frank Lloyd Wright, Pablo Picasso, the Dadaists, Abstract Expressionists, and many others.","","","","['Matthew Rohn']","200","['DC 305']","Art 1880-1950","","252","False","False","","1","C","20051","['MWF 0905-1000']","","Research","2005"
"10247","1.0","57","['ART']","This course is intended as an introduction to the history of Chinese art, offering a survey of major artistic developments from neolithic times to the present. Among the topics to be considered: ritual bronzes; funerary remains of the Qin and Han; Buddhist sculpture; and the evolution of landscape painting. Important issues to be discussed include production and patronage, function, and borrowing and influence in the evolution of artistic works across time and space.","","","","['Karil J. Kucera']","200","['DC 305']","Arts of China","","259","False","False","","1","O","20051","['MWF 1150-1245PM']","The Arts of China","Research","2005"
"10248","1.0","60","['ART']","This course explores the arts and architecture of western Europe from c. 300 to c. 1300. Through lectures and discussions we study paintings, sculpture, manuscripts, metalwork and stained glass windows created by the many cultures of this rich and diverse period in the history of art. Students approach the material in a variety of ways: in addition to issues of style, technique and iconography, students address issues of viewing, patronage and gender throughout the semester.","","","","['Nancy M. Thompson']","200","['DC 305', 'DC 305']","Medieval Art","","263","False","False","","1","C","20051","['T 0935-1100', 'Th 0930-1050']","","Research","2005"
"10249","1.0","68","['ART']","","","","","['Staff']","200","","Academic Internship","","294","True","False","","1","O","20051","","","Research","2005"
"10250","1.0","69","['ART']","","","","","['Patrick T. Kelley']","200","","IS/Advanced Web Design","","298","False","False","","1","O","20051","","","Research","2005"
"10251","1.0","69","['ART']","","","","","['Wendell Arneson']","200","","IS/Advanced Painting","","298","False","False","A","1","O","20051","","","Research","2005"
"10252","1.0","69","['ART']","","","","","['Ron Gallas']","200","","IS/Ceramic Exploration","","298","False","False","B","1","O","20051","","","Research","2005"
"10253","1.0","69","['ART']","","","","","['Patrick T. Kelley']","200","","IS/Digital Narrative","","298","False","False","C","1","O","20051","","","Research","2005"
"10254","1.0","69","['ART']","","","","","['Irve Dell']","200","","IS/The Female Figure","","298","False","False","D","1","O","20051","","","Research","2005"
"10255","1.0","69","['ART']","","","","","['John Saurer']","200","","IS/Space in Sculpture","","298","False","False","E","1","O","20051","","","Research","2005"
"10256","1.0","69","['ART']","","","","","['Patrick T. Kelley']","200","","IS/Textile Design","","298","False","False","F","1","O","20051","","","Research","2005"
"10257","1.0","69","['ART']","","","","","['John Saurer']","200","","IS/Fiber and Form","","298","False","False","G","1","O","20051","","","Research","2005"
"10258","1.0","69","['ART']","","","","","['Ron Gallas']","200","","IS/Conceptual Ceramics","","298","False","False","H","1","O","20051","","","Research","2005"
"10259","1.0","69","['ART']","","","","","['Staff']","200","","IS/","","298","False","False","I","1","O","20051","","","Research","2005"
"10260","1.0","70","['ART']","This course enables the advanced studio art student to pursue further work in any chosen two or three dimensional medium or combination of media including performance, installation and collaborative ways of working. This course is organized around an interdisciplinary theme set each year by the instructor. Within a seminar format students will read, discuss and write on the selected topic in conjunction with topic driven individual studio work and critiques. Prerequisites: Foundations plus a minimum of two Level II studio courses and two faculty recommendations or permission of instructor. Offered annually.","","","","['Mary Griep']","300","['DC 204']","Topics Sem/Studio Art","","340","False","Prerequisites: Foundations plus a minimum of two Level II studio courses and two faculty recommendations or permission of instructor. Offered annually.","","1","C","20051","['MWF 0800-1000']","Topics Seminar in Studio Art","Topic","2005"
"10261","1.0","73","['ART']","","","","","['Staff']","300","","Academic Internship","","394","True","False","","1","O","20051","","","Research","2005"
"10262","1.0","75","['ART']","Prerequisites: three courses in area of study.","","","","['Wendell Arneson']","300","","IR/Adv Expressive Oil","","398","False","Prerequisites: three courses in area of study.","","1","O","20051","","Independent Research: Art History","Research","2005"
"10263","1.0","75","['ART']","Prerequisites: three courses in area of study.","","","","['Nancy M. Thompson']","300","","IR/Cosimo Vasari: Renais","","398","False","Prerequisites: three courses in area of study.","A","1","O","20051","","Independent Research: Art History","Research","2005"
"10264","1.0","75","['ART']","Prerequisites: three courses in area of study.","","","","['Nancy M. Thompson']","300","","IR/Art Brazil/Haiti","","398","False","Prerequisites: three courses in area of study.","B","1","O","20051","","Independent Research: Art History","Research","2005"
"10265","1.0","75","['ART']","Prerequisites: three courses in area of study.","","","","['Staff']","300","","IR/","","398","False","Prerequisites: three courses in area of study.","C","1","O","20051","","Independent Research: Art History","Research","2005"
"10266","1.0","76","['ASIAN']","This seminar introduces students to East Asian cultures through the familiar institution of family. In contemporary novels, autobiographies and short stories, students read about the struggles between traditional ideals and modern pressures as East Asians strive to define themselves within families. The course also develops students' writing skills to prepare them for the rest of their college coursework.","","","","['Barbara Reed']","100","['OM 011', 'OM 011']","Family & Self/E Asia","","111","False","False","","1","C","20051","['T 1145-0110PM', 'Th 1245-0205PM']","Asian Conversations: Family and Self in East Asia","Research","2005"
"10267","1.0","78","['ASIAN']","This course examines major cultures of South, Southeast and East Asia from interdisciplinary and comparative perspectives with attention to theories of human behavior. Themes vary from year to year but may include Asian cities, heroic ideals, village and family life, population growth, gender roles and medicine and healing traditions. No prerequisites.","","","","['Karil J. Kucera']","100","['DC 305']","Asian Cultures","","121","False","False","","1","O","20051","['MWF 0200-0255PM']","Asian Cultures in Comparative Perspectives","Research","2005"
"10268","1.0","83","['ASIAN']","Students study basic concepts and approaches of film analysis, while examining aesthetics, themes and techniques of masterworks directed by Chinese Fifth Generation directors. Through readings of cinema theory and criticism and class discussions, students explore artistic merits in these films and aspects of Chinese society and culture in contemporary China, particularly the changes which occurred since 1978 with China's Four Modernizations. All readings are in English.","","","","['Pin Pin Wan']","100","['OM 001', 'OM 001']","Cont China Thru Film","","156","False","False","","1","C","20051","['T 1145-0110PM', 'Th 1245-0205PM']","Contemporary China Through Film","Research","2005"
